qa_id,question_type,question,answer,url
products_services__qa8,products_services,Công nghệ nào giúp CMC Chatbot hiểu ngôn ngữ tự nhiên?,"CMC Chatbot sử dụng công cụ phân loại ý định, truy xuất phản hồi và trích xuất thực thể trong chatbots.",https://cmcglobal.com.vn/vi/service/chatbot-1/
products_services__qa9,products_services,Dual Intent Entity Transformer là gì?,"Dual Intent Entity Transformer là công nghệ tiên tiến nhất trong công nghệ NLP, xử lý đồng thời việc phân loại ý định và nhận dạng thực thể.",https://cmcglobal.com.vn/vi/service/chatbot-1/
products_services__qa10,products_services,CMC Chatbot có những chức năng phân tích nào?,"CMC Chatbot hỗ trợ các chức năng phân tích thông minh như phân tích cảm xúc, phân tích hành vi, khuyến nghị, v.v.",https://cmcglobal.com.vn/vi/service/chatbot-1/
products_services__qa11,products_services,Hệ thống quản lý tri thức của CMC Chatbot hoạt động như thế nào?,"Hệ thống quản lý tri thức của CMC Chatbot quản lý kiến thức hiệu quả trong một hệ thống tập trung, hiển thị kiến thức ngầm.",https://cmcglobal.com.vn/vi/service/chatbot-1/
products_services__qa12,products_services,CMC Chatbot có khả năng phục vụ khách hàng 24/7 không?,"Có, CMC Chatbot hỗ trợ khách hàng 24/7.",https://cmcglobal.com.vn/vi/service/chatbot-1/
products_services__qa13,products_services,CMC Chatbot giúp tối đa hóa trải nghiệm của khách hàng như thế nào?,"CMC Chatbot tự động trả lời tin nhắn mọi lúc mọi nơi, tối đa hóa trải nghiệm của khách hàng với doanh nghiệp.",https://cmcglobal.com.vn/vi/service/chatbot-1/
products_services__qa14,products_services,Lợi ích chính của việc sử dụng CMC Chatbot là gì?,Lợi ích chính của CMC Chatbot là gia tăng sự hài lòng của khách hàng và giảm chi phí cho doanh nghiệp.,https://cmcglobal.com.vn/vi/service/chatbot-1/
products_services__qa15,products_services,CMC Chatbot có thể tự động hóa những quy trình nào?,CMC Chatbot có thể tự động hóa toàn bộ quy trình tương tác với khách hàng.,https://cmcglobal.com.vn/vi/service/chatbot-1/
products_services__qa16,products_services,CMC Chatbot có thể hỗ trợ doanh nghiệp trong việc giảm chi phí như thế nào?,CMC Chatbot giúp giảm chi phí đến 80% bằng cách tự động hóa quy trình và giải phóng tài nguyên.,https://cmcglobal.com.vn/vi/service/chatbot-1/
products_services__qa17,products_services,Ai là người phát triển công nghệ xử lý ngôn ngữ tự nhiên cho CMC Chatbot?,Công nghệ xử lý ngôn ngữ tự nhiên cho CMC Chatbot được phát triển từ Hugging Face’s Transformers library.,https://cmcglobal.com.vn/vi/service/chatbot-1/
products_services__qa18,products_services,CMC Chatbot có thể phân loại ý định như thế nào?,CMC Chatbot sử dụng công cụ để phân loại ý định và truy xuất phản hồi từ các tệp dữ liệu đào tạo.,https://cmcglobal.com.vn/vi/service/chatbot-1/
products_services__qa19,products_services,Công nghệ nào là cơ sở cho Dual Intent Entity Transformer trong CMC Chatbot?,"Dual Intent Entity Transformer là một kiến trúc máy biến tính đa tác vụ, xử lý đồng thời việc phân loại ý định và nhận dạng thực thể.",https://cmcglobal.com.vn/vi/service/chatbot-1/
products_services__qa20,products_services,CMC Chatbot có thể phân tích cảm xúc không?,"Có, CMC Chatbot hỗ trợ phân tích cảm xúc trong các chức năng phân tích thông minh của nó.",https://cmcglobal.com.vn/vi/service/chatbot-1/
products_services__qa1,products_services,C-ID Reader là ứng dụng gì?,"C-ID Reader là ứng dụng đọc và xác thực CMND nhúng chip, chạy trên Android và iOS.",https://cmcglobal.com.vn/vi/service/vi-c-id-reader/
products_services__qa2,products_services,C-ID Reader có thể đọc và xác minh thông tin gì?,C-ID Reader có thể đọc chip và truy xuất các chi tiết được nhúng trên thẻ ID.,https://cmcglobal.com.vn/vi/service/vi-c-id-reader/
products_services__qa3,products_services,C-ID Reader có tính năng gì nổi bật?,C-ID Reader là phần mềm độc lập hoàn toàn tự động đọc và xác minh dữ liệu cá nhân trong thẻ ID nhúng chip.,https://cmcglobal.com.vn/vi/service/vi-c-id-reader/
products_services__qa4,products_services,C-ID Reader giúp tổ chức cải thiện quy trình nào?,C-ID Reader giúp tổ chức nâng cao quy trình xác minh ID.,https://cmcglobal.com.vn/vi/service/vi-c-id-reader/
products_services__qa5,products_services,C-ID Reader tự động nhập dữ liệu như thế nào?,C-ID Reader tự động nhập dữ liệu thủ công bằng cách quét ID và nhanh chóng điền vào các trường của biểu mẫu điện tử.,https://cmcglobal.com.vn/vi/service/vi-c-id-reader/
products_services__qa6,products_services,C-ID Reader có khả năng gì trong việc kiểm tra ID?,C-ID Reader đọc và xác minh tính toàn vẹn và tính xác thực của chip được nhúng bằng một lần kiểm tra bổ sung.,https://cmcglobal.com.vn/vi/service/vi-c-id-reader/
products_services__qa7,products_services,C-ID Reader hoạt động trên những thiết bị nào?,C-ID Reader có thể chạy trên cả PC và thiết bị di động.,https://cmcglobal.com.vn/vi/service/vi-c-id-reader/
products_services__qa8,products_services,Lợi ích của việc sử dụng C-ID Reader là gì?,Một trong những lợi ích là tăng tốc độ nhập dữ liệu của khách và nâng cao hiệu quả của nhân viên lễ tân.,https://cmcglobal.com.vn/vi/service/vi-c-id-reader/
products_services__qa9,products_services,C-ID Reader giúp giảm thiểu lỗi như thế nào?,C-ID Reader giúp giảm khả năng xảy ra lỗi của con người bằng cách loại bỏ lỗi chính tả và lỗi gõ phím.,https://cmcglobal.com.vn/vi/service/vi-c-id-reader/
products_services__qa10,products_services,C-ID Reader tạo ra trải nghiệm nào cho khách hàng?,C-ID Reader thúc đẩy trải nghiệm khách hàng tích cực bằng cách cung cấp dịch vụ tốt nhất và quy trình xác minh nhanh nhất.,https://cmcglobal.com.vn/vi/service/vi-c-id-reader/
products_services__qa11,products_services,C-ID Reader có những tính năng nào trong xác thực ID?,C-ID Reader có tính năng đọc và xác minh thông tin nhúng trên thẻ ID và kiểm tra xác thực tính toàn vẹn của chip.,https://cmcglobal.com.vn/vi/service/vi-c-id-reader/
products_services__qa12,products_services,C-ID Reader có thể sử dụng trên thiết bị nào?,C-ID Reader có thể sử dụng trên điện thoại di động hoặc máy ảnh web.,https://cmcglobal.com.vn/vi/service/vi-c-id-reader/
products_services__qa13,products_services,Tính năng tự động hoá dữ liệu của C-ID Reader có ưu điểm gì?,Tính năng tự động hoá dữ liệu giúp tăng tốc quy trình nhập liệu và giảm thiểu sai sót.,https://cmcglobal.com.vn/vi/service/vi-c-id-reader/
products_services__qa14,products_services,C-ID Reader hỗ trợ tổ chức như thế nào trong quy trình xác minh ID?,C-ID Reader giúp tổ chức nâng cao quy trình xác minh ID bằng cách tự động hóa việc đọc và xác minh dữ liệu.,https://cmcglobal.com.vn/vi/service/vi-c-id-reader/
products_services__qa15,products_services,C-ID Reader có thể giảm thiểu những sai sót nào trong quá trình xác minh?,C-ID Reader có thể giảm thiểu lỗi chính tả và lỗi gõ phím trong quá trình nhập liệu.,https://cmcglobal.com.vn/vi/service/vi-c-id-reader/
products_services__qa16,products_services,C-ID Reader có thể cải thiện hiệu quả công việc ra sao?,C-ID Reader có thể cải thiện hiệu quả công việc bằng cách đẩy nhanh quá trình xác minh và nhập dữ liệu.,https://cmcglobal.com.vn/vi/service/vi-c-id-reader/
products_services__qa17,products_services,C-ID Reader có tính năng kiểm tra nào để đảm bảo thông tin chính xác?,C-ID Reader thực hiện kiểm tra xác thực để đảm bảo thông tin trong tài liệu vật lý là đáng tin cậy.,https://cmcglobal.com.vn/vi/service/vi-c-id-reader/
products_services__qa18,products_services,C-ID Reader mang đến lợi ích gì cho nhân viên lễ tân?,C-ID Reader giúp nhân viên lễ tân nâng cao hiệu quả làm việc và giảm thời gian xác minh ID.,https://cmcglobal.com.vn/vi/service/vi-c-id-reader/
products_services__qa19,products_services,C-ID Reader có thể sử dụng để làm gì ngoài việc xác minh ID?,C-ID Reader có thể sử dụng để tự động hóa quá trình nhập liệu vào các biểu mẫu điện tử.,https://cmcglobal.com.vn/vi/service/vi-c-id-reader/
products_services__qa20,products_services,C-ID Reader giúp cải thiện trải nghiệm khách hàng như thế nào?,C-ID Reader giúp cải thiện trải nghiệm khách hàng bằng cách cung cấp dịch vụ nhanh chóng và chính xác.,https://cmcglobal.com.vn/vi/service/vi-c-id-reader/
products_services__qa1,products_services,CMC CA là gì?,CMC CA là một dạng chữ ký điện tử sử dụng hệ thống mật mã bất đối xứng (PKI) để mã hóa dữ liệu doanh nghiệp và thay thế chữ ký trên văn bản.,https://cmcglobal.com.vn/vi/service/vi-c-ca/
products_services__qa2,products_services,Chữ ký số sử dụng USB Token hoạt động như thế nào?,"Chữ ký số sử dụng USB Token hoạt động bằng cách lưu cặp khóa và chứng thư số trên thiết bị USB Token, cho phép người dùng ký chỉ với việc cắm USB token vào máy tính.",https://cmcglobal.com.vn/vi/service/vi-c-ca/
products_services__qa3,products_services,Làm thế nào để ký từ xa với C-CA?,"Để ký từ xa với C-CA, cặp khóa và chứng chỉ số của khách hàng được lưu trữ trên thiết bị phần cứng HSM, và người dùng cần đăng ký tài khoản trên hệ thống và đăng nhập để cấp con dấu yêu cầu mật khẩu và xác thực hai bước.",https://cmcglobal.com.vn/vi/service/vi-c-ca/
products_services__qa4,products_services,Một trong những lợi ích của C-CA là gì?,"Một trong những lợi ích của C-CA là cung cấp sự tiện lợi, cho phép các đối tác ký tài liệu ở mọi lúc mọi nơi mà không cần gửi hợp đồng từ nơi này sang nơi khác.",https://cmcglobal.com.vn/vi/service/vi-c-ca/
products_services__qa5,products_services,C-CA có thể giúp tiết kiệm chi phí như thế nào?,"C-CA giúp tiết kiệm chi phí bằng cách giảm thiểu các chi phí liên quan đến in ấn, quét và giao hàng, đồng thời vẫn đảm bảo bảo mật.",https://cmcglobal.com.vn/vi/service/vi-c-ca/
products_services__qa6,products_services,Tài liệu ký bằng C-CA có hiệu lực pháp lý không?,"Có, tài liệu được ký bằng C-CA tạo ra các tài liệu ràng buộc về mặt pháp lý không thể chối bỏ và có hiệu lực pháp lý lâu dài.",https://cmcglobal.com.vn/vi/service/vi-c-ca/
products_services__qa7,products_services,C-CA có ảnh hưởng đến môi trường không?,C-CA giúp giảm tác động đến môi trường bằng cách giảm thiểu lượng giấy và tài liệu cần sử dụng trong quy trình làm việc.,https://cmcglobal.com.vn/vi/service/vi-c-ca/
products_services__qa8,products_services,Người dùng cần làm gì để sử dụng chữ ký số qua USB Token?,Người dùng chỉ cần cắm USB Token vào máy tính để sử dụng chữ ký số.,https://cmcglobal.com.vn/vi/service/vi-c-ca/
products_services__qa9,products_services,C-CA có yêu cầu gì để ký từ xa?,"Để ký từ xa, người dùng cần đăng ký tài khoản trên hệ thống và thực hiện xác thực hai bước khi đăng nhập.",https://cmcglobal.com.vn/vi/service/vi-c-ca/
products_services__qa10,products_services,Có bao nhiêu lợi ích chính của C-CA được đề cập?,"Có ba lợi ích chính của C-CA được đề cập: cung cấp sự tiện lợi, tạo tài liệu ràng buộc pháp lý và tiết kiệm tiền giảm tác động môi trường.",https://cmcglobal.com.vn/vi/service/vi-c-ca/
products_services__qa11,products_services,Tại sao việc ký tài liệu từ xa lại quan trọng?,"Việc ký tài liệu từ xa quan trọng vì nó mang lại sự linh hoạt và tiện lợi cho người dùng, cho phép họ thực hiện ký kết từ bất kỳ đâu.",https://cmcglobal.com.vn/vi/service/vi-c-ca/
products_services__qa12,products_services,Chữ ký điện tử CMC CA sử dụng công nghệ gì?,Chữ ký điện tử CMC CA sử dụng công nghệ mật mã bất đối xứng (PKI) để mã hóa và bảo vệ dữ liệu.,https://cmcglobal.com.vn/vi/service/vi-c-ca/
products_services__qa13,products_services,C-CA có thể giúp doanh nghiệp trong việc nào?,C-CA có thể giúp doanh nghiệp tiết kiệm chi phí và giảm thiểu tác động đến môi trường mà không ảnh hưởng đến bảo mật.,https://cmcglobal.com.vn/vi/service/vi-c-ca/
products_services__qa14,products_services,Lợi ích về pháp lý của C-CA là gì?,Lợi ích pháp lý của C-CA là đảm bảo rằng tài liệu đã ký sẽ có hiệu lực pháp lý lâu dài và không thể chối bỏ.,https://cmcglobal.com.vn/vi/service/vi-c-ca/
products_services__qa15,products_services,Người dùng cần phải làm gì để ký tài liệu qua USB Token?,Người dùng chỉ cần cắm USB Token vào máy tính của mình để ký tài liệu.,https://cmcglobal.com.vn/vi/service/vi-c-ca/
products_services__qa16,products_services,Mục đích của việc sử dụng chữ ký số là gì?,Mục đích của việc sử dụng chữ ký số là thay thế chữ ký truyền thống và đảm bảo tính bảo mật và hợp pháp cho các tài liệu.,https://cmcglobal.com.vn/vi/service/vi-c-ca/
products_services__qa17,products_services,Có cách nào để ký tài liệu mà không cần di chuyển?,"Có, người dùng có thể ký tài liệu từ xa thông qua hệ thống C-CA mà không cần phải di chuyển.",https://cmcglobal.com.vn/vi/service/vi-c-ca/
products_services__qa18,products_services,C-CA có ảnh hưởng đến quy trình làm việc như thế nào?,"C-CA cải thiện quy trình làm việc bằng cách loại bỏ nhu cầu in ấn và gửi tài liệu, giúp tiết kiệm thời gian và chi phí.",https://cmcglobal.com.vn/vi/service/vi-c-ca/
products_services__qa19,products_services,C-CA có đảm bảo bảo mật cho tài liệu không?,"Có, C-CA đảm bảo bảo mật cho tài liệu thông qua việc sử dụng công nghệ mã hóa và xác thực.",https://cmcglobal.com.vn/vi/service/vi-c-ca/
products_services__qa20,products_services,C-CA có những tính năng nổi bật nào?,C-CA có những tính năng nổi bật như chữ ký số sử dụng USB Token và khả năng ký từ xa với sự xác thực an toàn.,https://cmcglobal.com.vn/vi/service/vi-c-ca/
products_services__qa1,products_services,SOC là gì?,"SOC (Security Operation Center) là trung tâm an ninh mạng CMC có chức năng giám sát, phát hiện, xử lý sự cố và chịu trách nhiệm đảm bảo an toàn an ninh cho toàn bộ hệ thống thông tin của tổ chức.",https://cmcglobal.com.vn/vi/service/vi-soc/
products_services__qa2,products_services,CMC SOC hoạt động như thế nào?,"CMC SOC hoạt động 24/7 để giám sát, phát hiện và xử lý sự cố an ninh.",https://cmcglobal.com.vn/vi/service/vi-soc/
products_services__qa3,products_services,Dịch vụ giám sát an ninh của CMC SOC có điểm gì nổi bật?,"Dịch vụ giám sát an ninh của CMC SOC tích hợp trí tuệ nhân tạo, máy học và các giải pháp bảo mật tiên tiến khác để theo dõi hệ thống mạng và ứng dụng 24/7.",https://cmcglobal.com.vn/vi/service/vi-soc/
products_services__qa4,products_services,Tại sao cần dịch vụ ứng phó sự cố của CMC?,Dịch vụ ứng phó sự cố của CMC giúp xử lý các sự cố an ninh nghiêm trọng và tiến hành phân tích pháp y để giải quyết các cuộc tấn công mạng ngay lập tức.,https://cmcglobal.com.vn/vi/service/vi-soc/
products_services__qa5,products_services,Đội ngũ CMC SOC làm gì khi xảy ra sự cố an ninh?,Đội ngũ CMC SOC hợp tác với các tổ chức để xử lý sự cố an ninh và triển khai giải pháp lâu dài để ngăn chặn sự tái diễn.,https://cmcglobal.com.vn/vi/service/vi-soc/
products_services__qa6,products_services,CMC SOC có đội ngũ chuyên gia nào?,Các chuyên gia an ninh của CMC giàu kinh nghiệm trong việc bảo mật và truy tìm các mối đe doạ tiềm ẩn.,https://cmcglobal.com.vn/vi/service/vi-soc/
products_services__qa7,products_services,Có bao nhiêu dịch vụ mà CMC SOC cung cấp?,"CMC SOC cung cấp nhiều dịch vụ, trong đó bao gồm giám sát an ninh, ứng phó sự cố và truy tìm mối đe doạ.",https://cmcglobal.com.vn/vi/service/vi-soc/
products_services__qa8,products_services,Dịch vụ giám sát an ninh của CMC có đảm bảo phát hiện mối nguy hiểm không?,"Có, dịch vụ giám sát an ninh của CMC đảm bảo phát hiện và khắc phục ngay lập tức bất kỳ lỗi và mối nguy hiểm nào.",https://cmcglobal.com.vn/vi/service/vi-soc/
products_services__qa9,products_services,CMC SOC có thể giúp gì cho tổ chức của tôi?,"CMC SOC có thể giúp tổ chức của bạn giám sát an ninh mạng, phát hiện sự cố và ứng phó kịp thời với các mối đe doạ.",https://cmcglobal.com.vn/vi/service/vi-soc/
products_services__qa10,products_services,Giám sát an ninh 24/7 của CMC có lợi ích gì?,Giám sát an ninh 24/7 giúp bảo vệ hệ thống mạng và ứng dụng khỏi các mối đe doạ liên tục và kịp thời xử lý sự cố.,https://cmcglobal.com.vn/vi/service/vi-soc/
products_services__qa11,products_services,Tính năng nào của dịch vụ ứng phó sự cố là quan trọng nhất?,Tính năng quan trọng nhất là khả năng triển khai giải pháp lâu dài để ngăn chặn sự tái diễn các cuộc tấn công mạng.,https://cmcglobal.com.vn/vi/service/vi-soc/
products_services__qa12,products_services,CMC SOC sử dụng công nghệ gì trong dịch vụ giám sát?,"CMC SOC sử dụng trí tuệ nhân tạo, máy học và các giải pháp bảo mật tiên tiến khác trong dịch vụ giám sát.",https://cmcglobal.com.vn/vi/service/vi-soc/
products_services__qa13,products_services,Truy tìm mối đe doạ của CMC SOC có gì đặc biệt?,Truy tìm mối đe doạ của CMC SOC được thực hiện bởi các chuyên gia an ninh giàu kinh nghiệm để bảo mật hạ tầng CNTT.,https://cmcglobal.com.vn/vi/service/vi-soc/
products_services__qa14,products_services,Dịch vụ nào của CMC SOC giúp giảm thiểu rủi ro từ sự cố an ninh?,Dịch vụ ứng phó sự cố giúp giảm thiểu rủi ro từ sự cố an ninh bằng cách xử lý ngay lập tức và phân tích pháp y.,https://cmcglobal.com.vn/vi/service/vi-soc/
products_services__qa15,products_services,CMC SOC có bảo đảm an toàn cho hệ thống thông tin không?,"Có, CMC SOC có trách nhiệm đảm bảo an toàn an ninh cho toàn bộ hệ thống thông tin của tổ chức.",https://cmcglobal.com.vn/vi/service/vi-soc/
products_services__qa16,products_services,Làm thế nào CMC SOC phát hiện các mối đe doạ?,CMC SOC phát hiện các mối đe doạ thông qua giám sát liên tục và phân tích dữ liệu an ninh.,https://cmcglobal.com.vn/vi/service/vi-soc/
products_services__qa17,products_services,Khách hàng có thể mong đợi gì từ dịch vụ giám sát an ninh của CMC?,"Khách hàng có thể mong đợi sự theo dõi, giám sát liên tục và khả năng phát hiện sự cố kịp thời từ dịch vụ giám sát an ninh của CMC.",https://cmcglobal.com.vn/vi/service/vi-soc/
products_services__qa18,products_services,Dịch vụ nào giúp tổ chức ứng phó nhanh chóng với các cuộc tấn công mạng?,Dịch vụ ứng phó sự cố giúp tổ chức ứng phó nhanh chóng với các cuộc tấn công mạng.,https://cmcglobal.com.vn/vi/service/vi-soc/
products_services__qa19,products_services,Ai là người thực hiện các dịch vụ bảo mật tại CMC SOC?,Các chuyên gia an ninh có kinh nghiệm thực hiện các dịch vụ bảo mật tại CMC SOC.,https://cmcglobal.com.vn/vi/service/vi-soc/
products_services__qa20,products_services,CMC SOC có thể theo dõi các ứng dụng của khách hàng như thế nào?,CMC SOC theo dõi các ứng dụng của khách hàng bằng cách sử dụng công nghệ giám sát tiên tiến 24/7.,https://cmcglobal.com.vn/vi/service/vi-soc/
products_services__qa1,products_services,Mô hình nào mà CMC Global áp dụng cho các dự án?,CMC Global áp dụng mô hình Project-based cho các dự án.,https://cmcglobal.com.vn/vi/service/project-based-3/
products_services__qa2,products_services,Khách hàng có thể uỷ thác công việc cho ai trong mô hình Project-based?,Khách hàng có thể uỷ thác toàn bộ công việc cho CMC Global.,https://cmcglobal.com.vn/vi/service/project-based-3/
products_services__qa3,products_services,Ai sẽ đảm nhận vai trò kỹ sư và quản lý dự án trong mô hình này?,Đội ngũ kỹ sư và quản lý dự án của CMC Global sẽ đảm nhận vai trò này.,https://cmcglobal.com.vn/vi/service/project-based-3/
products_services__qa4,products_services,Một trong những lợi ích của mô hình Project-based là gì?,Một trong những lợi ích là giá cố định.,https://cmcglobal.com.vn/vi/service/project-based-3/
products_services__qa5,products_services,Mô hình Project-based có đảm bảo bàn giao đúng hẹn không?,"Có, mô hình Project-based đảm bảo bàn giao đúng hẹn.",https://cmcglobal.com.vn/vi/service/project-based-3/
products_services__qa6,products_services,CMC Global ước tính chi phí dự án dựa trên yếu tố nào?,CMC Global ước tính chi phí dựa trên phạm vi của dự án.,https://cmcglobal.com.vn/vi/service/project-based-3/
products_services__qa7,products_services,Kết quả của mô hình Project-based được thể hiện như thế nào?,Kết quả của mô hình Project-based được thể hiện rõ ràng.,https://cmcglobal.com.vn/vi/service/project-based-3/
products_services__qa8,products_services,Mô hình nào phù hợp với các dự án ngắn hạn?,Mô hình Project-based phù hợp với các dự án ngắn hạn.,https://cmcglobal.com.vn/vi/service/project-based-3/
products_services__qa9,products_services,Các dự án nào là đối tượng của mô hình Project-based?,Các dự án một lần và các dự án ngắn hạn là đối tượng của mô hình Project-based.,https://cmcglobal.com.vn/vi/service/project-based-3/
products_services__qa10,products_services,Mô hình này có phù hợp với các dự án đã được xác định trước không?,"Có, mô hình Project-based phù hợp với các dự án đã được xác định trước.",https://cmcglobal.com.vn/vi/service/project-based-3/
products_services__qa11,products_services,Mô hình nào thích hợp cho doanh nghiệp không có đội ngũ phát triển nội bộ?,Mô hình Project-based thích hợp cho doanh nghiệp không có đội ngũ phát triển nội bộ.,https://cmcglobal.com.vn/vi/service/project-based-3/
products_services__qa12,products_services,Mô hình Project-based có thể áp dụng cho các dự án có điều kiện thị trường ổn định không?,"Có, mô hình Project-based có thể áp dụng cho các dự án có điều kiện thị trường ổn định.",https://cmcglobal.com.vn/vi/service/project-based-3/
products_services__qa13,products_services,Điều gì khiến mô hình Project-based trở nên hấp dẫn cho doanh nghiệp?,Mô hình Project-based hấp dẫn vì nó có giá cố định và đảm bảo bàn giao đúng hẹn.,https://cmcglobal.com.vn/vi/service/project-based-3/
products_services__qa14,products_services,Khách hàng cần làm gì để bắt đầu với mô hình Project-based?,Khách hàng cần liên hệ với CMC Global để bắt đầu với mô hình Project-based.,https://cmcglobal.com.vn/vi/service/project-based-3/
products_services__qa15,products_services,Mô hình Project-based có lợi ích gì về mặt chi phí?,Mô hình Project-based có lợi ích về mặt chi phí là giá cố định.,https://cmcglobal.com.vn/vi/service/project-based-3/
products_services__qa16,products_services,Có những loại dự án nào không phù hợp với mô hình Project-based?,Mô hình Project-based không phù hợp với các dự án dài hạn hoặc không xác định rõ ràng.,https://cmcglobal.com.vn/vi/service/project-based-3/
