qa_id,question_type,question,answer,url
products_services__qa10,products_services,Lợi ích của việc phát triển phần mềm theo yêu cầu là gì?,Phát triển phần mềm theo yêu cầu giúp doanh nghiệp đáp ứng linh hoạt các yêu cầu cụ thể mà không cần bên thứ ba.,https://cmcglobal.com.vn/vi/service/custom-software-development-4/
products_services__qa11,products_services,CMC Global có chuyên môn gì trong lĩnh vực phát triển ứng dụng di động?,CMC Global có chuyên môn sâu rộng về các công nghệ iOS & Android và đa nền tảng.,https://cmcglobal.com.vn/vi/service/custom-software-development-4/
products_services__qa12,products_services,"Trong quy trình phát triển phần mềm, giai đoạn nào liên quan đến việc tạo ra các chi tiết cấu thành?",Giai đoạn xây dựng sản phẩm liên quan đến việc tạo ra các chi tiết cấu thành và chức năng cần thiết.,https://cmcglobal.com.vn/vi/service/custom-software-development-4/
products_services__qa13,products_services,CMC Global làm gì để xác định rủi ro và định giá dịch vụ?,"CMC Global thực hiện nghiên cứu để hiểu rõ các yêu cầu, quy trình kinh doanh và thông số kỹ thuật cần thiết của sản phẩm nhằm đánh giá rủi ro và định giá dịch vụ.",https://cmcglobal.com.vn/vi/service/custom-software-development-4/
products_services__qa14,products_services,Ai sẽ tham gia vào quy trình phản hồi trong giai đoạn xây dựng sản phẩm?,"Trong giai đoạn xây dựng sản phẩm, CMC Global yêu cầu ý kiến phản hồi từ khách hàng và các chuyên gia kỹ thuật.",https://cmcglobal.com.vn/vi/service/custom-software-development-4/
products_services__qa15,products_services,Dịch vụ phát triển ứng dụng web của CMC Global mang lại lợi ích gì?,Dịch vụ phát triển ứng dụng web mang lại những giải pháp kỹ thuật xuất sắc và đáp ứng toàn bộ các khía cạnh về phát triển phần mềm.,https://cmcglobal.com.vn/vi/service/custom-software-development-4/
products_services__qa16,products_services,Những yếu tố nào được xem xét khi triển khai sản phẩm?,"Khi triển khai sản phẩm, CMC Global đảm bảo rằng sản phẩm vận hành trơn tru và được kiểm thử kĩ càng.",https://cmcglobal.com.vn/vi/service/custom-software-development-4/
products_services__qa17,products_services,Tại sao việc thiết kế sản phẩm là quan trọng?,Việc thiết kế sản phẩm quan trọng vì nó giúp tránh sai sót và thiết lập các tiêu chuẩn cho quy trình phát triển.,https://cmcglobal.com.vn/vi/service/custom-software-development-4/
products_services__qa18,products_services,Khách hàng có thể yêu cầu gì trong quá trình hỗ trợ và bảo trì?,"Khách hàng có thể yêu cầu cải tiến, nâng cấp và tích hợp thêm dịch vụ theo các gói đã thỏa thuận hoặc các dịch vụ bổ sung.",https://cmcglobal.com.vn/vi/service/custom-software-development-4/
products_services__qa19,products_services,CMC Global có thể linh hoạt điều chỉnh gì trong quá trình triển khai sản phẩm?,CMC Global có thể linh hoạt thay đổi thông số kỹ thuật hệ thống theo nhu cầu của khách hàng.,https://cmcglobal.com.vn/vi/service/custom-software-development-4/
products_services__qa20,products_services,Các dịch vụ phát triển phần mềm của CMC Global có đặc điểm gì nổi bật?,Các dịch vụ phát triển phần mềm của CMC Global nổi bật ở chỗ cung cấp giải pháp trọn chu kỳ phát triển phần mềm từ phát triển đến hỗ trợ và bảo trì.,https://cmcglobal.com.vn/vi/service/custom-software-development-4/
products_services__qa1,products_services,Dịch vụ bảo trì phần mềm của công ty có tác dụng gì?,"Dịch vụ bảo trì phần mềm giúp doanh nghiệp giám sát, quản lý, bảo mật toàn bộ cơ sở hạ tầng, cho phép doanh nghiệp yên tâm tập trung vào công việc kinh doanh chính.",https://cmcglobal.com.vn/vi/service/software-maintenance-3/
products_services__qa2,products_services,Các vấn đề nào có thể được giải quyết thông qua dịch vụ hỗ trợ phần mềm?,"Dịch vụ hỗ trợ phần mềm có thể kiểm tra lỗi, giải quyết các truy vấn, sửa lỗi, phát triển các tính năng mới hoặc cập nhật mã code cho doanh nghiệp.",https://cmcglobal.com.vn/vi/service/software-maintenance-3/
products_services__qa3,products_services,Công ty cung cấp dịch vụ giám sát mạng như thế nào?,Công ty giúp doanh nghiệp tìm ra các vấn đề về cơ sở hạ tầng mạng và giám sát thông qua các công cụ giám sát mạng thời gian thực.,https://cmcglobal.com.vn/vi/service/software-maintenance-3/
products_services__qa4,products_services,Kỹ sư On-Site của công ty có nhiệm vụ gì?,"Kỹ sư On-Site xử lý các vấn đề yêu cầu sự can thiệp tại chỗ, đảm bảo hiệu suất tối đa với đội ngũ kỹ sư CNTT được đào tạo chuyên sâu và phiên dịch chuyên nghiệp.",https://cmcglobal.com.vn/vi/service/software-maintenance-3/
products_services__qa5,products_services,Quy trình phân tích được thực hiện như thế nào?,Chúng tôi thảo luận và thực hiện đánh giá các thách thức liên quan tới CNTT hiện tại của khách hàng để đặt ra các mục tiêu S.M.A.R.T.,https://cmcglobal.com.vn/vi/service/software-maintenance-3/
products_services__qa6,products_services,CMC Global có những quy trình gì trong dịch vụ của mình?,"CMC Global cung cấp các quy trình và kế hoạch quản lý CNTT đơn giản và tiêu chuẩn, phù hợp với ngân sách, yêu cầu và mục tiêu của doanh nghiệp.",https://cmcglobal.com.vn/vi/service/software-maintenance-3/
products_services__qa7,products_services,Lợi ích của dịch vụ bảo trì phần mềm là gì?,Lợi ích của dịch vụ bảo trì phần mềm là giúp doanh nghiệp giảm thiểu rủi ro về bảo mật và nâng cao hiệu quả hoạt động của cơ sở hạ tầng.,https://cmcglobal.com.vn/vi/service/software-maintenance-3/
products_services__qa8,products_services,Dịch vụ quản trị và hỗ trợ của công ty hoạt động như thế nào?,Chúng tôi đáp ứng yêu cầu của khách hàng nhanh chóng và cung cấp giải pháp hiệu quả nhất khi được yêu cầu.,https://cmcglobal.com.vn/vi/service/software-maintenance-3/
products_services__qa9,products_services,Công ty cung cấp dịch vụ gì để quản lý và giám sát từ xa?,"Công ty bảo trì và cập nhật máy móc, giúp các chuyên gia chủ động nắm bắt và giải quyết các vấn đề từ xa.",https://cmcglobal.com.vn/vi/service/software-maintenance-3/
products_services__qa10,products_services,Những thách thức nào có thể được đánh giá trong quy trình phân tích?,Những thách thức liên quan tới CNTT hiện tại của khách hàng sẽ được đánh giá để xác định các mục tiêu S.M.A.R.T.,https://cmcglobal.com.vn/vi/service/software-maintenance-3/
products_services__qa11,products_services,Dịch vụ nào giúp phát triển các tính năng mới cho phần mềm?,Dịch vụ hỗ trợ phần mềm bao gồm phát triển các tính năng mới cũng như sửa lỗi và cập nhật mã code.,https://cmcglobal.com.vn/vi/service/software-maintenance-3/
products_services__qa12,products_services,Công ty có những chuyên gia nào hỗ trợ trong việc bảo trì phần mềm?,Công ty có đội ngũ kỹ sư CNTT được đào tạo chuyên sâu và phiên dịch chuyên nghiệp để đảm bảo hiệu suất tối đa.,https://cmcglobal.com.vn/vi/service/software-maintenance-3/
products_services__qa13,products_services,Dịch vụ giám sát mạng giúp ích gì cho doanh nghiệp?,Dịch vụ giám sát mạng giúp doanh nghiệp phát hiện và khắc phục các vấn đề về cơ sở hạ tầng mạng kịp thời.,https://cmcglobal.com.vn/vi/service/software-maintenance-3/
products_services__qa14,products_services,CMC Global có những tiêu chí nào trong việc lên kế hoạch quản lý CNTT?,"CMC Global cung cấp các quy trình và kế hoạch phù hợp với ngân sách, yêu cầu và mục tiêu của doanh nghiệp.",https://cmcglobal.com.vn/vi/service/software-maintenance-3/
products_services__qa15,products_services,Công ty có thể cung cấp giải pháp gì khi có yêu cầu từ khách hàng?,Công ty sẽ đáp ứng yêu cầu của khách hàng nhanh chóng và cung cấp giải pháp hiệu quả nhất.,https://cmcglobal.com.vn/vi/service/software-maintenance-3/
products_services__qa16,products_services,"Về dịch vụ bảo trì phần mềm, doanh nghiệp có thể yên tâm về điều gì?",Doanh nghiệp có thể yên tâm về việc giám sát và bảo mật toàn bộ cơ sở hạ tầng của mình.,https://cmcglobal.com.vn/vi/service/software-maintenance-3/
products_services__qa17,products_services,Dịch vụ nào của công ty giúp kiểm tra lỗi phần mềm?,Dịch vụ hỗ trợ phần mềm bao gồm việc kiểm tra lỗi và giải quyết các truy vấn liên quan.,https://cmcglobal.com.vn/vi/service/software-maintenance-3/
products_services__qa18,products_services,Công ty có cách nào để chủ động nắm bắt vấn đề về CNTT?,Công ty bảo trì và cập nhật máy móc để các chuyên gia có thể chủ động nắm bắt và giải quyết các vấn đề từ xa.,https://cmcglobal.com.vn/vi/service/software-maintenance-3/
products_services__qa19,products_services,Dịch vụ bảo trì phần mềm có giúp kinh doanh của doanh nghiệp hiệu quả hơn không?,"Có, dịch vụ bảo trì phần mềm giúp doanh nghiệp tập trung vào công việc kinh doanh chính mà không lo lắng về vấn đề hạ tầng CNTT.",https://cmcglobal.com.vn/vi/service/software-maintenance-3/
products_services__qa20,products_services,Làm thế nào để công ty xác định mục tiêu trong quy trình phân tích?,Công ty xác định mục tiêu thông qua việc thảo luận và đánh giá các thách thức liên quan tới CNTT hiện tại của khách hàng.,https://cmcglobal.com.vn/vi/service/software-maintenance-3/
products_services__qa1,products_services,Dịch vụ quản lý ứng dụng của CMC GLOBAL có gì nổi bật?,"Dịch vụ quản lý ứng dụng của CMC GLOBAL là dịch vụ hàng đầu tại Việt Nam, cung cấp giá trị tốt nhất cho khách hàng.",https://cmcglobal.com.vn/vi/service/application-managed-service-2/
products_services__qa2,products_services,Gói Tiêu Chuẩn của CMC GLOBAL bao gồm những dịch vụ gì?,"Gói Tiêu Chuẩn bao gồm hỗ trợ các dịch vụ về ứng dụng, sửa chữa và bảo trì khẩn cấp.",https://cmcglobal.com.vn/vi/service/application-managed-service-2/
products_services__qa3,products_services,Dịch vụ sửa chữa và bảo trì khẩn cấp của CMC GLOBAL có những hoạt động nào?,"Dịch vụ bao gồm bảo trì khắc phục đột xuất, xác định và loại bỏ lỗi, chỉnh sửa dữ liệu, sửa chữa sự cố khẩn cấp.",https://cmcglobal.com.vn/vi/service/application-managed-service-2/
products_services__qa4,products_services,Gói Cao Cấp cung cấp dịch vụ gì cho khách hàng?,"Gói Cao Cấp cung cấp bảo trì phòng ngừa và dự đoán, cùng với cải tiến ứng dụng.",https://cmcglobal.com.vn/vi/service/application-managed-service-2/
products_services__qa5,products_services,CMC GLOBAL thực hiện những biện pháp gì để đảm bảo sự hài lòng của khách hàng?,CMC GLOBAL xử lý yêu cầu của người dùng hiệu quả và cung cấp dịch vụ theo SLA đã thỏa thuận.,https://cmcglobal.com.vn/vi/service/application-managed-service-2/
products_services__qa6,products_services,Các chuyên gia của CMC tại Việt Nam có thể hỗ trợ gì cho khách hàng?,Các chuyên gia có thể cung cấp dịch vụ quản lý ứng dụng hàng đầu và tư vấn để đạt được giá trị tốt nhất.,https://cmcglobal.com.vn/vi/service/application-managed-service-2/
products_services__qa7,products_services,Lợi ích của việc cải tiến ứng dụng trong gói dịch vụ của CMC GLOBAL là gì?,"Cải tiến ứng dụng giúp phát triển chức năng mới, cải thiện hiệu suất và tối ưu hóa độ bảo mật.",https://cmcglobal.com.vn/vi/service/application-managed-service-2/
products_services__qa8,products_services,CMC GLOBAL giải quyết các vấn đề về dữ liệu như thế nào?,CMC GLOBAL giải quyết nhanh chóng các vấn đề về dữ liệu và triển khai các bản sửa lỗi cốt lõi.,https://cmcglobal.com.vn/vi/service/application-managed-service-2/
products_services__qa9,products_services,Làm thế nào CMC GLOBAL đảm bảo tính liên tục trong kinh doanh?,CMC GLOBAL duy trì tính liên tục trong kinh doanh bằng cách giải quyết nhanh chóng các vấn đề và đảm bảo tính toàn vẹn dữ liệu.,https://cmcglobal.com.vn/vi/service/application-managed-service-2/
products_services__qa10,products_services,Giám sát hiệu suất ứng dụng có vai trò gì trong dịch vụ của CMC GLOBAL?,Giám sát hiệu suất ứng dụng giúp tối ưu hóa hiệu suất hệ thống thông qua việc đánh giá thường xuyên.,https://cmcglobal.com.vn/vi/service/application-managed-service-2/
products_services__qa11,products_services,Ai là người cung cấp dịch vụ quản lý ứng dụng hàng đầu tại Việt Nam?,CMC GLOBAL là công ty cung cấp dịch vụ quản lý ứng dụng hàng đầu tại Việt Nam.,https://cmcglobal.com.vn/vi/service/application-managed-service-2/
products_services__qa12,products_services,Các giải pháp phòng ngừa của CMC GLOBAL nhằm mục đích gì?,Các giải pháp phòng ngừa nhằm xác định nguyên nhân gốc rễ của lỗi hệ thống và tránh sự cố xảy ra trong tương lai.,https://cmcglobal.com.vn/vi/service/application-managed-service-2/
products_services__qa13,products_services,Có những chỉ số hiệu suất nào được CMC GLOBAL giám sát?,CMC GLOBAL giám sát các chỉ số hiệu suất ứng dụng để tối ưu hóa hiệu suất hệ thống.,https://cmcglobal.com.vn/vi/service/application-managed-service-2/
products_services__qa14,products_services,Gói dịch vụ nào của CMC GLOBAL hỗ trợ quản lý quyền/truy cập hệ thống?,Gói Tiêu Chuẩn hỗ trợ quản lý quyền/truy cập hệ thống.,https://cmcglobal.com.vn/vi/service/application-managed-service-2/
products_services__qa15,products_services,Dịch vụ nào của CMC GLOBAL giúp phát triển chức năng mới cho ứng dụng?,Dịch vụ cải tiến ứng dụng trong gói Cao Cấp giúp phát triển chức năng mới.,https://cmcglobal.com.vn/vi/service/application-managed-service-2/
products_services__qa16,products_services,CMC GLOBAL thực hiện những biện pháp gì để khôi phục hoạt động bình thường?,CMC GLOBAL thực hiện các biện pháp khắc phục ngay lập tức để khôi phục hoạt động bình thường với thời gian nhanh nhất.,https://cmcglobal.com.vn/vi/service/application-managed-service-2/
products_services__qa17,products_services,Các chuyên gia của CMC GLOBAL có thể hỗ trợ gì trong quản lý ứng dụng?,"Các chuyên gia có thể thực hiện yêu cầu, quản lý sự cố và hướng dẫn sử dụng.",https://cmcglobal.com.vn/vi/service/application-managed-service-2/
products_services__qa18,products_services,Bảo trì thường xuyên trong gói Cao Cấp có ý nghĩa gì?,Bảo trì thường xuyên giúp đảm bảo hệ thống hoạt động ổn định và hiệu suất cao.,https://cmcglobal.com.vn/vi/service/application-managed-service-2/
products_services__qa19,products_services,CMC GLOBAL có những hoạt động nào để tối ưu hóa hiệu suất mã và cơ sở dữ liệu?,CMC GLOBAL cải thiện độ tin cậy và khả năng bảo trì của hệ thống thông qua nâng cấp và tái cấu trúc chiến lược.,https://cmcglobal.com.vn/vi/service/application-managed-service-2/
products_services__qa20,products_services,Dịch vụ Q&A trong gói Tiêu Chuẩn có vai trò gì?,Dịch vụ Q&A giúp người dùng giải đáp thắc mắc và hướng dẫn sử dụng ứng dụng.,https://cmcglobal.com.vn/vi/service/application-managed-service-2/
products_services__qa1,products_services,CMC Global cung cấp dịch vụ chuyển đổi hệ thống cho những loại ngôn ngữ nào?,"CMC Global cung cấp dịch vụ chuyển đổi hệ thống cho nhiều loại ngôn ngữ, bao gồm RPG, Pascal, Python và JAVA.",https://cmcglobal.com.vn/vi/service/legacy-migration-4/
products_services__qa2,products_services,Dịch vụ Hiện đại hóa phần mềm của CMC Global có những lựa chọn nào?,"CMC Global cung cấp dịch vụ Hiện đại hóa phần mềm với nhiều lựa chọn như di chuyển đầu cuối, hiện đại hóa và tái thiết kế.",https://cmcglobal.com.vn/vi/service/legacy-migration-4/
products_services__qa3,products_services,Có những lợi ích gì khi sử dụng dịch vụ Cloud Migration của CMC Global?,"Dịch vụ Cloud Migration của CMC Global giúp giảm chi phí, thời gian hoàn thành và cải thiện khả năng mở rộng cũng như khả năng tiếp cận.",https://cmcglobal.com.vn/vi/service/legacy-migration-4/
products_services__qa4,products_services,CMC Global có chuyên môn trong lĩnh vực nào liên quan đến UX Modernization?,CMC Global cung cấp giải pháp để nâng cao trải nghiệm người dùng trên nhiều nền tảng và giao diện nhúng bên trong sản phẩm.,https://cmcglobal.com.vn/vi/service/legacy-migration-4/
products_services__qa5,products_services,Quy trình thẩm định của CMC Global được thực hiện như thế nào?,"CMC Global đánh giá hệ thống để xác định các vấn đề và phân loại chúng thành các mục như lỗi thời, để lưu trữ, hợp nhất hoặc chuyển đổi.",https://cmcglobal.com.vn/vi/service/legacy-migration-4/
products_services__qa6,products_services,Những công cụ nào được sử dụng trong quy trình Migration của CMC Global?,"Các chuyên gia của CMC Global sử dụng các công cụ và nguồn mở để thu thập yêu cầu, phát triển, xác minh, kiểm thử và di chuyển.",https://cmcglobal.com.vn/vi/service/legacy-migration-4/
products_services__qa7,products_services,Lợi ích của việc hiện đại hóa phần mềm là gì?,Việc hiện đại hóa phần mềm giúp doanh nghiệp đáp ứng các yêu cầu kinh doanh mới và cải thiện hiệu suất hệ thống.,https://cmcglobal.com.vn/vi/service/legacy-migration-4/
products_services__qa8,products_services,CMC Global có thể hỗ trợ doanh nghiệp trong những giai đoạn nào của quá trình chuyển đổi?,"CMC Global hỗ trợ trong các giai đoạn thẩm định, migration, định nghĩa kiến trúc và triển khai.",https://cmcglobal.com.vn/vi/service/legacy-migration-4/
products_services__qa9,products_services,Tại sao doanh nghiệp cần dịch vụ chuyển đổi hệ thống của CMC Global?,Doanh nghiệp cần dịch vụ chuyển đổi hệ thống để cập nhật với các nhu cầu kinh doanh đang thay đổi và giảm chi phí cũng như rủi ro.,https://cmcglobal.com.vn/vi/service/legacy-migration-4/
products_services__qa10,products_services,Đội ngũ bảo trì của CMC Global có vai trò gì sau khi hoàn thành quá trình chuyển đổi?,Đội ngũ bảo trì của CMC Global sẵn sàng hỗ trợ nếu doanh nghiệp cần thêm trợ giúp sau khi hoàn thành quá trình chuyển đổi.,https://cmcglobal.com.vn/vi/service/legacy-migration-4/
products_services__qa11,products_services,Dịch vụ nào ở CMC Global giúp chuyển cơ sở hạ tầng CNTT lên Cloud?,"Dịch vụ Cloud Migration giúp chuyển cơ sở hạ tầng CNTT, ứng dụng lên Cloud.",https://cmcglobal.com.vn/vi/service/legacy-migration-4/
products_services__qa12,products_services,CMC Global có kinh nghiệm như thế nào trong lĩnh vực Cloud Migration?,CMC Global tự hào là nhà cung cấp dịch vụ Cloud Migration đáng tin cậy với nhiều dự án thành công tại Việt Nam.,https://cmcglobal.com.vn/vi/service/legacy-migration-4/
products_services__qa13,products_services,Vì sao cần phải xác định kiến trúc của hệ thống trong quy trình chuyển đổi?,Việc xác định kiến trúc của hệ thống giúp lên kế hoạch cho cơ sở hạ tầng trong tương lai và các bước di chuyển mã.,https://cmcglobal.com.vn/vi/service/legacy-migration-4/
products_services__qa14,products_services,Các chuyên gia của CMC Global có kinh nghiệm trong lĩnh vực nào?,Các chuyên gia của CMC Global có kinh nghiệm dày dạn trong việc chuyển đổi phần mềm và sử dụng các công cụ hiện đại.,https://cmcglobal.com.vn/vi/service/legacy-migration-4/
products_services__qa15,products_services,Dịch vụ chuyển đổi hệ thống có tác động như thế nào đến hiệu suất của doanh nghiệp?,Dịch vụ chuyển đổi hệ thống giúp nâng cao hiệu suất của doanh nghiệp bằng cách cập nhật công nghệ và cải thiện quy trình làm việc.,https://cmcglobal.com.vn/vi/service/legacy-migration-4/
products_services__qa16,products_services,CMC Global có những công nghệ nào để hiện đại hóa phần mềm?,"CMC Global luôn cập nhật các phiên bản Java, Ruby, .NET, JavaScript, Perl, Python để hiện đại hóa phần mềm.",https://cmcglobal.com.vn/vi/service/legacy-migration-4/
products_services__qa17,products_services,Làm thế nào để CMC Global đảm bảo quá trình chuyển đổi diễn ra liền mạch?,CMC Global lên kế hoạch với các framework hiệu quả và an toàn để đảm bảo quá trình chuyển đổi diễn ra liền mạch.,https://cmcglobal.com.vn/vi/service/legacy-migration-4/
products_services__qa18,products_services,Doanh nghiệp có thể mong đợi điều gì từ dịch vụ Cloud Migration?,"Doanh nghiệp có thể mong đợi chi phí thấp hơn, thời gian hoàn thành nhanh hơn và khả năng mở rộng cải thiện từ dịch vụ Cloud Migration.",https://cmcglobal.com.vn/vi/service/legacy-migration-4/
products_services__qa19,products_services,CMC Global có thể phục vụ doanh nghiệp ở những nền tảng nào?,CMC Global có thể phục vụ doanh nghiệp trên nhiều nền tảng khác nhau để nâng cao trải nghiệm người dùng.,https://cmcglobal.com.vn/vi/service/legacy-migration-4/
products_services__qa20,products_services,Quá trình kiểm thử và xác thực chức năng diễn ra ở giai đoạn nào?,Quá trình kiểm thử và xác thực chức năng diễn ra sau khi kết thúc quá trình chuyển đổi.,https://cmcglobal.com.vn/vi/service/legacy-migration-4/
products_services__qa1,products_services,Dịch vụ kiểm thử của CMC Global có mục đích gì?,"Dịch vụ kiểm thử của CMC Global giúp doanh nghiệp tránh được những thiệt hại tiềm ẩn có thể dẫn đến những sự cố, gây ảnh hưởng tới lợi nhuận và khách hàng.",https://cmcglobal.com.vn/vi/service/testing-service-3/
products_services__qa2,products_services,Kiểm thử thủ công bao gồm những loại nào?,"Dịch vụ kiểm thử thủ công bao gồm Acceptance Testing, System Testing, Integration Testing, Usability Testing, Smoke Testing, Sanity Testing, Confirmation Testing và Regression Testing.",https://cmcglobal.com.vn/vi/service/testing-service-3/
products_services__qa3,products_services,Kiểm thử tự động hoá có lợi ích gì cho doanh nghiệp?,"Kiểm thử tự động hoá giúp giảm công sức và thời gian cho kiểm thử, đồng thời rút ngắn vòng đời phân phối.",https://cmcglobal.com.vn/vi/service/testing-service-3/
products_services__qa4,products_services,Các loại kiểm tra hiệu suất mà CMC Global cung cấp là gì?,"Chúng tôi cung cấp dịch vụ cho tất cả các loại Kiểm tra hiệu suất bao gồm Load Testing, Stress Testing, Volume Testing, Endurance Testing, Spike Testing và High Availability Testing.",https://cmcglobal.com.vn/vi/service/testing-service-3/
products_services__qa5,products_services,Kiểm thử thâm nhập có thể thực hiện trên những nền tảng nào?,"Tester của chúng tôi có thể thực hiện nhiều loại Kiểm tra thâm nhập như Network Services, Web Application, Mobile Application, Client-side, Social Engineering và Physical Penetration Testing.",https://cmcglobal.com.vn/vi/service/testing-service-3/
products_services__qa6,products_services,Dịch vụ kiểm thử đám mây bao gồm những loại kiểm thử nào?,"Dịch vụ kiểm thử đám mây bao gồm System Testing, Stress Testing, Load Testing, Latency Testing, Availability Testing và Security Testing.",https://cmcglobal.com.vn/vi/service/testing-service-3/
