qa_id,question_type,question,answer,url
company_overview__qa1,company_overview,CMC Global cung cấp giải pháp gì cho khách hàng?,"CMC Global cung cấp giải pháp IT một cửa, bao gồm IT Outsourcing, Chuyển đổi số và các giải pháp CMC với nhiều mô hình dịch vụ khác nhau.",https://cmcglobal.com.vn/
company_overview__qa2,company_overview,Giải pháp IT Outsourcing của CMC Global mang lại lợi ích gì?,"Giải pháp IT Outsourcing của CMC Global giúp các doanh nghiệp sáng tạo và tiên tiến duy trì hạ tầng IT mà không cần sự can thiệp của bên thứ ba, đồng thời cung cấp các tính năng tùy chỉnh trong quá trình phát triển phần mềm.",https://cmcglobal.com.vn/
company_overview__qa3,company_overview,CMC Global hỗ trợ chuyển đổi số như thế nào?,CMC Global hỗ trợ việc áp dụng các công nghệ tiên tiến để tối ưu hóa hiệu quả và chi phí trong quá trình hoạt động kinh doanh.,https://cmcglobal.com.vn/
company_overview__qa4,company_overview,Dịch vụ nào thuộc danh mục giải pháp của CMC Global?,"Các dịch vụ thuộc danh mục giải pháp của CMC Global bao gồm IT Outsourcing, Chuyển đổi số và các giải pháp CMC.",https://cmcglobal.com.vn/
company_overview__qa5,company_overview,Các giải pháp CMC Global có gì đặc biệt?,"Giải pháp của CMC Global bao gồm các dịch vụ chuyên nghiệp như nhận diện thông tin ID, nhận diện khuôn mặt và giải pháp Social Listening để phân tích thông tin tốt hơn.",https://cmcglobal.com.vn/
company_overview__qa6,company_overview,CMC Global có những mô hình làm việc nào?,"CMC Global cung cấp nhiều mô hình làm việc để các doanh nhân toàn cầu lựa chọn, nhằm đạt được kết quả tối ưu nhất.",https://cmcglobal.com.vn/
company_overview__qa7,company_overview,Tại sao nên chọn CMC Global cho IT Outsourcing?,CMC Global là lựa chọn hàng đầu cho IT Outsourcing vì họ cung cấp giải pháp tùy chỉnh và không cần bên thứ ba can thiệp.,https://cmcglobal.com.vn/
company_overview__qa8,company_overview,CMC Global có hỗ trợ gì để giảm tải công việc quản lý không?,CMC Global cung cấp dịch vụ thuê ngoài quy trình kinh doanh toàn diện để giảm tải công việc quản lý và tăng hiệu quả làm việc.,https://cmcglobal.com.vn/
company_overview__qa9,company_overview,Lợi ích của việc sử dụng công nghệ tiên tiến tại CMC Global là gì?,Việc sử dụng công nghệ tiên tiến tại CMC Global giúp tối ưu hóa hiệu quả và chi phí trong hoạt động kinh doanh.,https://cmcglobal.com.vn/
company_overview__qa10,company_overview,CMC Global có những dịch vụ nào trong việc nhận diện thông tin?,CMC Global cung cấp dịch vụ nhận diện thông tin ID và nhận diện khuôn mặt trong các giải pháp của mình.,https://cmcglobal.com.vn/
company_overview__qa11,company_overview,CMC Global có thể giúp doanh nghiệp như thế nào trong quá trình chuyển đổi số?,CMC Global có thể giúp doanh nghiệp bằng cách cung cấp các giải pháp công nghệ tối ưu và các dịch vụ thuê ngoài để nâng cao hiệu quả quản lý.,https://cmcglobal.com.vn/
company_overview__qa12,company_overview,Khách hàng của CMC Global thuộc những ngành nào?,CMC Global hỗ trợ khách hàng thuộc mọi quy mô và ngành nghề trong việc triển khai các giải pháp công nghệ.,https://cmcglobal.com.vn/
company_overview__qa13,company_overview,Giải pháp nào của CMC Global giúp phân tích thông tin tốt hơn?,Giải pháp Social Listening của CMC Global giúp cung cấp cái nhìn và phân tích thông tin tốt hơn.,https://cmcglobal.com.vn/
company_overview__qa14,company_overview,Các doanh nghiệp có thể mong đợi điều gì từ các mô hình làm việc của CMC Global?,"Các doanh nghiệp có thể mong đợi mô hình làm việc hiệu quả, tương thích và tối ưu chi phí từ CMC Global.",https://cmcglobal.com.vn/
company_overview__qa15,company_overview,CMC Global có thể tối ưu hóa chi phí cho doanh nghiệp như thế nào?,CMC Global tối ưu hóa chi phí cho doanh nghiệp bằng cách áp dụng công nghệ tiên tiến và cung cấp các giải pháp dịch vụ hợp lý.,https://cmcglobal.com.vn/
company_overview__qa16,company_overview,CMC Global có những dịch vụ nào để hỗ trợ quản lý doanh nghiệp?,"CMC Global cung cấp các dịch vụ như nhận diện thông tin ID, nhận diện khuôn mặt và các giải pháp để hỗ trợ quản lý doanh nghiệp.",https://cmcglobal.com.vn/
company_overview__qa17,company_overview,Giải pháp một cửa tại CMC Global bao gồm những gì?,"Giải pháp một cửa tại CMC Global bao gồm IT Outsourcing, Chuyển đổi số và các giải pháp CMC.",https://cmcglobal.com.vn/
company_overview__qa18,company_overview,CMC Global có những công nghệ nào hỗ trợ cho doanh nghiệp?,CMC Global sử dụng các công nghệ tiên tiến nhất để hỗ trợ doanh nghiệp trong việc tối ưu hóa hoạt động.,https://cmcglobal.com.vn/
company_overview__qa19,company_overview,Khách hàng của CMC Global có thể nhận được gì từ dịch vụ thuê ngoài quy trình kinh doanh?,Khách hàng có thể giảm tải công việc quản lý và tăng cường hiệu quả làm việc từ dịch vụ thuê ngoài quy trình kinh doanh của CMC Global.,https://cmcglobal.com.vn/
company_overview__qa20,company_overview,Làm thế nào để CMC Global giúp doanh nghiệp theo kịp yêu cầu IT?,CMC Global giúp doanh nghiệp theo kịp yêu cầu IT bằng cách cung cấp giải pháp IT Outsourcing và các tính năng tùy chỉnh trong phát triển phần mềm.,https://cmcglobal.com.vn/
company_overview__qa1,company_overview,CMC Global có sứ mệnh gì?,"CMC Global có sứ mệnh thiết lập các dịch vụ đẳng cấp thế giới cho các doanh nghiệp trên toàn cầu, tập trung vào việc đổi mới giá trị cốt lõi trong chất lượng nguồn nhân lực và quy trình làm việc. ",https://cmcglobal.com.vn/about-us/
company_overview__qa2,company_overview,Tầm nhìn của CMC Global là gì?,"Tầm nhìn của CMC Global là trở thành một trong những công ty dịch vụ IT lớn nhất tại Việt Nam và nằm trong top 10 khu vực, cung cấp các giải pháp công nghệ mới như Chuyển đổi số, AI và Cloud.",https://cmcglobal.com.vn/about-us/
company_overview__qa3,company_overview,CMC Global được thành lập vào năm nào?,CMC Global được thành lập vào tháng 3 năm 2017 như là doanh nghiệp chủ lực của Tập đoàn CMC.,https://cmcglobal.com.vn/about-us/
company_overview__qa4,company_overview,CMC Global đã đạt được giải thưởng gì vào năm 2019?,"CMC Global đã nhận được Giải Sao Khuê đầu tiên trong hạng mục ""Dịch vụ IT Outsourcing"" vào tháng 4 năm 2019.",https://cmcglobal.com.vn/about-us/
company_overview__qa5,company_overview,CMC Global có bao nhiêu nhân viên vào thời điểm thành lập?,"Khi thành lập, CMC Global chỉ có 50 nhân viên.",https://cmcglobal.com.vn/about-us/
company_overview__qa6,company_overview,CMC Global có những giá trị cốt lõi nào?,"CMC Global có 4 giá trị cốt lõi: Tập trung vào khách hàng, Tốc độ, Sáng tạo, và Cam kết.",https://cmcglobal.com.vn/about-us/
company_overview__qa7,company_overview,CMC Global mở văn phòng đầu tiên ở đâu?,"CMC Global đã mở văn phòng đầu tiên tại Yokohama, Nhật Bản vào tháng 8 năm 2017.",https://cmcglobal.com.vn/about-us/
company_overview__qa8,company_overview,Lãnh đạo của CMC Global là ai?,CEO của CMC Global là ông Đặng Ngọc Bảo.,https://cmcglobal.com.vn/about-us/
company_overview__qa9,company_overview,CMC Global đã đạt được giải thưởng nào vào năm 2020?,"CMC Global đã nhận được các giải Sao Khuê liên tiếp cho ""Dịch vụ IT Outsourcing"" vào năm 2020.",https://cmcglobal.com.vn/about-us/
company_overview__qa10,company_overview,CMC Global có bao nhiêu khách hàng toàn cầu?,CMC Global có hơn 300 khách hàng toàn cầu.,https://cmcglobal.com.vn/about-us/
company_overview__qa11,company_overview,Văn phòng chính của CMC Global nằm ở đâu?,"Văn phòng chính của CMC Global nằm tại Hà Nội, tại số 11 Duy Tân, quận Cầu Giấy.",https://cmcglobal.com.vn/about-us/
company_overview__qa12,company_overview,CMC Global có bao nhiêu đối tác kinh doanh?,CMC Global có hơn 35 đối tác kinh doanh.,https://cmcglobal.com.vn/about-us/
company_overview__qa13,company_overview,CMC Global đã mở văn phòng nào tại Việt Nam vào năm 2020?,CMC Global đã mở văn phòng mới tại Hà Nội vào tháng 5 năm 2020.,https://cmcglobal.com.vn/about-us/
company_overview__qa14,company_overview,CMC Global có văn phòng nào ở Nhật Bản?,"CMC Global có hai văn phòng ở Nhật Bản, một ở Tokyo và một ở Osaka.",https://cmcglobal.com.vn/about-us/
company_overview__qa15,company_overview,CMC Global có bao nhiêu năm kinh nghiệm trong ngành?,CMC Global có hơn 31 năm kinh nghiệm trong ngành.,https://cmcglobal.com.vn/about-us/
company_overview__qa16,company_overview,Những tiêu chuẩn quốc tế nào được CMC Global áp dụng?,"CMC Global áp dụng các tiêu chuẩn quốc tế như ISO 27001:2013, ISO 9001:2015, CMMi Level 5, và chứng chỉ AWS Cloud.",https://cmcglobal.com.vn/about-us/
company_overview__qa17,company_overview,CMC Global đã nhận giải thưởng nào vào năm 2022?,"CMC Global đã nhận giải Sao Khuê 2022 trong hạng mục ""Dịch vụ IT Outsourcing"".",https://cmcglobal.com.vn/about-us/
company_overview__qa18,company_overview,CMC Global đã mở văn phòng nào tại Singapore?,"CMC Global đã mở văn phòng tại Hong Leong Building, Singapore vào tháng 8 năm 2020.",https://cmcglobal.com.vn/about-us/
company_overview__qa19,company_overview,CMC Global có bao nhiêu kỹ sư được chứng nhận?,CMC Global có hơn 3000 kỹ sư được chứng nhận.,https://cmcglobal.com.vn/about-us/
company_overview__qa20,company_overview,CMC Global có bao nhiêu quốc gia có mặt?,CMC Global có mặt tại hơn 30 quốc gia.,https://cmcglobal.com.vn/about-us/
company_overview__qa1,company_overview,CMC Corporation được thành lập vào năm nào?,CMC Corporation được thành lập vào năm 1993.,https://cmcglobal.com.vn/cmc-corporation/
company_overview__qa2,company_overview,CMC Corporation đứng thứ mấy trong số các tập đoàn công nghệ tại Việt Nam?,CMC Corporation là tập đoàn công nghệ lớn thứ hai tại Việt Nam.,https://cmcglobal.com.vn/cmc-corporation/
company_overview__qa3,company_overview,Các hoạt động kinh doanh chính của CMC Corporation là gì?,"Các hoạt động kinh doanh chính của CMC Corporation bao gồm: Công nghệ & Giải pháp, Kinh doanh quốc tế và Dịch vụ viễn thông.",https://cmcglobal.com.vn/cmc-corporation/
company_overview__qa4,company_overview,CMC Corporation có trụ sở chính ở đâu?,Trụ sở chính của CMC Corporation nằm ở Thành phố Hồ Chí Minh.,https://cmcglobal.com.vn/cmc-corporation/
company_overview__qa5,company_overview,"Đến năm 2023, CMC Corporation đặt mục tiêu gì về doanh thu?","Đến năm 2023, CMC Corporation đặt mục tiêu trở thành công ty tỷ đô với doanh thu 1 tỷ USD.",https://cmcglobal.com.vn/cmc-corporation/
company_overview__qa6,company_overview,CMC Corporation đã được vinh danh trong danh sách nào về các công ty ICT hàng đầu tại Việt Nam vào năm 2015?,CMC Corporation được xếp hạng số 1 trong danh sách “Top 5 ICT Companies 2015”.,https://cmcglobal.com.vn/cmc-corporation/
company_overview__qa7,company_overview,Năm nào CMC Corporation chính thức đổi tên thành CMC Corporation?,CMC Corporation chính thức đổi tên vào năm 2007.,https://cmcglobal.com.vn/cmc-corporation/
company_overview__qa8,company_overview,CMC Corporation đã thành lập công ty nào vào năm 2008?,"Vào năm 2008, CMC Corporation đã thành lập CMC Information Security JSC (nay là CMC Infosec).",https://cmcglobal.com.vn/cmc-corporation/
company_overview__qa9,company_overview,CMC Corporation đã mở văn phòng ở đâu vào tháng 11 năm 2017?,"CMC Corporation đã mở văn phòng tại Yokohama, Kanagawa Prefecture, Nhật Bản vào tháng 11 năm 2017.",https://cmcglobal.com.vn/cmc-corporation/
company_overview__qa10,company_overview,Năm nào CMC Corporation được vinh danh với cờ thi đua dưới danh hiệu ‘Người dẫn đầu xuất sắc’?,CMC Corporation đã nhận được cờ thi đua dưới danh hiệu ‘Người dẫn đầu xuất sắc’ vào năm 2014.,https://cmcglobal.com.vn/cmc-corporation/
company_overview__qa11,company_overview,CMC Corporation đã đạt doanh thu bao nhiêu USD trong năm tài chính 2018?,"Trong năm tài chính 2018, CMC Corporation đạt doanh thu 260 triệu USD.",https://cmcglobal.com.vn/cmc-corporation/
company_overview__qa12,company_overview,"Đến năm 2019, CMC Corporation dự kiến doanh thu là bao nhiêu?","Đến năm 2019, CMC Corporation dự kiến doanh thu đạt 326 triệu USD.",https://cmcglobal.com.vn/cmc-corporation/
company_overview__qa13,company_overview,CMC Corporation đã thành lập trung tâm nào vào năm 2017?,CMC Corporation đã thành lập CMC Innovation Center vào năm 2017.,https://cmcglobal.com.vn/cmc-corporation/
company_overview__qa14,company_overview,CMC Telecom đã ký kết thỏa thuận đầu tư chiến lược với công ty nào vào năm 2015?,CMC Telecom đã ký kết thỏa thuận đầu tư chiến lược với TimedotCom Berhad (TIME) vào năm 2015.,https://cmcglobal.com.vn/cmc-corporation/
company_overview__qa15,company_overview,CMC Corporation đã vinh danh trong danh sách nào về thương hiệu nổi tiếng ASEAN vào năm 2013?,CMC Soft đã được vinh danh trong Top 20 ASEAN Famous Brands vào năm 2013.,https://cmcglobal.com.vn/cmc-corporation/
company_overview__qa16,company_overview,Năm nào CMC Corporation chính thức đăng ký hơn 63.5 triệu cổ phiếu trên sàn giao dịch chứng khoán?,CMC Corporation chính thức đăng ký hơn 63.5 triệu cổ phiếu vào năm 2010.,https://cmcglobal.com.vn/cmc-corporation/
company_overview__qa17,company_overview,CMC Corporation đã mở rộng hoạt động ra quốc tế vào năm nào?,CMC Corporation đã công bố chiến lược ‘Go Global’ vào năm 2017.,https://cmcglobal.com.vn/cmc-corporation/
company_overview__qa18,company_overview,CMC SI đã nhận giải thưởng nào từ Microsoft vào năm 2016?,CMC SI đã nhận giải thưởng Đối tác 2016 từ Microsoft.,https://cmcglobal.com.vn/cmc-corporation/
company_overview__qa19,company_overview,"Trong giai đoạn 2010 - 2012, CMC Corporation đã mở cửa công ty nào tại TP. Hồ Chí Minh?","CMC Corporation đã mở cửa CMC System Integration Saigon Co., Ltd. (CMC SI Saigon) vào năm 2012.",https://cmcglobal.com.vn/cmc-corporation/
company_overview__qa20,company_overview,CMC Corporation đã ra mắt hệ sinh thái nào cho doanh nghiệp vào tháng 4 năm 2019?,CMC Corporation đã ra mắt CMC Open Ecosystem for Enterprise (C.OPE2N) vào tháng 4 năm 2019.,https://cmcglobal.com.vn/cmc-corporation/
products_services__qa1,products_services,CMC Global cung cấp những dịch vụ nào để hỗ trợ sự phát triển kỹ thuật số cho doanh nghiệp?,"CMC Global cung cấp các giải pháp IT và kỹ thuật số toàn diện, bao gồm phát triển phần mềm, chuyển đổi kỹ thuật số và tư vấn IT.",https://cmcglobal.com.vn/service-page/
products_services__qa2,products_services,Công ty CMC Global có những giải pháp nào để cải thiện hiệu quả kinh doanh?,"CMC Global cung cấp các giải pháp như trí tuệ nhân tạo (AI), điện toán đám mây, tự động hóa robot (RPA) và Low Code để giúp doanh nghiệp tiết kiệm chi phí và cải thiện hiệu quả.",https://cmcglobal.com.vn/service-page/
products_services__qa3,products_services,Dịch vụ phát triển phần mềm tùy chỉnh mà CMC Global cung cấp là gì?,"CMC Global cung cấp dịch vụ phát triển phần mềm tùy chỉnh, bảo trì phần mềm, di chuyển hệ thống cũ và các dịch vụ kiểm thử.",https://cmcglobal.com.vn/service-page/
products_services__qa4,products_services,CMC Global có những mô hình làm việc nào cho các doanh nghiệp?,"CMC Global cung cấp các mô hình làm việc như dựa trên dự án, tăng cường nhân sự, híbrido và dựa trên kết quả.",https://cmcglobal.com.vn/service-page/
products_services__qa5,products_services,Dịch vụ nào của CMC Global được thiết kế cho các doanh nghiệp khởi nghiệp?,CMC Global cung cấp dịch vụ phát triển phần mềm Agile và MVP (Sản phẩm khả thi tối thiểu) giúp biến ý tưởng thành dự án thực tế với nỗ lực tối thiểu.,https://cmcglobal.com.vn/service-page/
products_services__qa6,products_services,Lợi ích của chuyển đổi kỹ thuật số mà CMC Global mang lại là gì?,Chuyển đổi kỹ thuật số giúp tối ưu hóa quy trình hiện tại và phát hiện những khả năng mới cho sản phẩm và dịch vụ kiểm thử.,https://cmcglobal.com.vn/service-page/
products_services__qa7,products_services,CMC Global đã hợp tác với những ngành nào?,"CMC Global đã hợp tác với các ngành như logistics, fintech, chăm sóc sức khỏe, công nghệ ô tô, sản xuất và truyền thông giải trí.",https://cmcglobal.com.vn/service-page/
products_services__qa8,products_services,Ai có thể được hưởng lợi từ dịch vụ chuyển đổi kỹ thuật số của CMC Global?,Doanh nghiệp lớn có thể hưởng lợi từ dịch vụ chuyển đổi kỹ thuật số quy mô lớn để tăng năng suất trong khi duy trì hoặc cải thiện chất lượng.,https://cmcglobal.com.vn/service-page/
products_services__qa9,products_services,Dịch vụ nào được cung cấp cho lĩnh vực tài chính tại CMC Global?,CMC Global đã hợp tác với một công ty fintech tại Singapore để áp dụng công nghệ đổi mới cho hệ thống ngân hàng tại Đông Nam Á.,https://cmcglobal.com.vn/service-page/
products_services__qa10,products_services,CMC Global cung cấp dịch vụ gì cho ngành chăm sóc sức khỏe?,CMC Global làm việc với khách hàng tại các bệnh viện ở Hàn Quốc để phát triển và duy trì các ứng dụng.,https://cmcglobal.com.vn/service-page/
products_services__qa11,products_services,Các dịch vụ nào của CMC Global liên quan đến tự động hóa?,CMC Global cung cấp dịch vụ tự động hóa robot (RPA) và các giải pháp liên quan đến AI.,https://cmcglobal.com.vn/service-page/
products_services__qa12,products_services,Dịch vụ nào CMC Global cung cấp để hỗ trợ sản xuất chip bán dẫn?,CMC Global đã cải thiện hệ thống sản xuất chip bán dẫn và phát triển ứng dụng web để hỗ trợ quy trình tài khoản phải thu.,https://cmcglobal.com.vn/service-page/
products_services__qa13,products_services,Có những giải pháp nào để cải thiện việc quản lý thông tin tại CMC Global?,CMC Global cung cấp các dịch vụ như nhận diện khuôn mặt và giải pháp lắng nghe xã hội để phân tích thông tin tốt hơn.,https://cmcglobal.com.vn/service-page/
products_services__qa14,products_services,CMC Global có những kỹ năng gì trong việc phát triển phần mềm?,"CMC Global có đội ngũ kỹ sư hàng đầu, cung cấp các dịch vụ phát triển phần mềm, bảo trì, di chuyển và kiểm thử.",https://cmcglobal.com.vn/service-page/
products_services__qa15,products_services,Khách hàng của CMC Global có thể mong đợi điều gì từ dịch vụ đám mây?,"Khách hàng có thể tiếp cận đội ngũ chuyên gia chứng nhận sử dụng các hệ thống IT từ các nhà cung cấp lớn như AWS, Microsoft Azure và Google Cloud.",https://cmcglobal.com.vn/service-page/
products_services__qa16,products_services,CMC Global đã giúp khách hàng trong ngành truyền thông giải trí như thế nào?,CMC Global đã giúp khách hàng di chuyển toàn bộ hệ thống hoạt động của họ lên đám mây trong vòng 6 tháng.,https://cmcglobal.com.vn/service-page/
products_services__qa17,products_services,Đội ngũ nào của CMC Global tham gia vào các dự án phát triển phần mềm?,Đội ngũ kỹ sư của CMC Global chuyên nghiệp và tận tâm tham gia vào các dự án phát triển phần mềm.,https://cmcglobal.com.vn/service-page/
products_services__qa18,products_services,Có những dịch vụ nào liên quan đến thiết bị IoT mà CMC Global cung cấp?,CMC Global cung cấp giải pháp thiết bị thông minh IoT như CIVAMs face để cải thiện hiệu quả quản lý.,https://cmcglobal.com.vn/service-page/
products_services__qa19,products_services,CMC Global có thể giúp doanh nghiệp nhỏ như thế nào?,CMC Global cung cấp giải pháp chuyển đổi kỹ thuật số để tối ưu hóa quy trình hiện tại và khám phá các khả năng mới cho sản phẩm.,https://cmcglobal.com.vn/service-page/
products_services__qa20,products_services,Tại sao CMC Global là đối tác đáng tin cậy cho doanh nghiệp?,"CMC Global cam kết cung cấp dịch vụ chất lượng cao, đổi mới và sự hài lòng của khách hàng, làm cho họ trở thành đối tác đáng tin cậy cho các tổ chức trên toàn cầu.",https://cmcglobal.com.vn/service-page/
products_services__qa1,products_services,CMC Global cung cấp dịch vụ gì cho các doanh nghiệp?,"CMC Global cung cấp dịch vụ phát triển phần mềm theo yêu cầu, giúp các doanh nghiệp bắt kịp với các yêu cầu về cơ sở hạ tầng và CNTT.",https://cmcglobal.com.vn/vi/service/custom-software-development-4/
products_services__qa2,products_services,Dịch vụ nào được cung cấp trong lĩnh vực phát triển ứng dụng di động?,"CMC Global cung cấp tùy chọn phát triển ứng dụng cho các thiết bị di động, đáp ứng yêu cầu về giá cả, tiêu chuẩn chất lượng và yêu cầu dự án.",https://cmcglobal.com.vn/vi/service/custom-software-development-4/
products_services__qa3,products_services,Các khía cạnh nào được đáp ứng trong dịch vụ phát triển phần mềm theo yêu cầu?,"Dịch vụ phát triển phần mềm theo yêu cầu đáp ứng các khía cạnh về design, architecture, coding, testing, release engineering, requirements, và usability.",https://cmcglobal.com.vn/vi/service/custom-software-development-4/
products_services__qa4,products_services,Quy trình nào được thực hiện để hiểu rõ các yêu cầu phần mềm?,"Quy trình hiểu giải pháp, yêu cầu được thực hiện thông qua nghiên cứu để định nghĩa các chức năng và điều kiện hoạt động của phần mềm.",https://cmcglobal.com.vn/vi/service/custom-software-development-4/
products_services__qa5,products_services,CMC Global thực hiện những gì trong giai đoạn thiết kế sản phẩm?,"Trong giai đoạn thiết kế sản phẩm, CMC Global xây dựng kiến trúc phần mềm để tránh sai sót và thiết lập các tiêu chuẩn cho đội ngũ nhân sự.",https://cmcglobal.com.vn/vi/service/custom-software-development-4/
products_services__qa6,products_services,Thời điểm nào sản phẩm được phát hành?,Sản phẩm chỉ được phát hành khi đã được kiểm thử kĩ càng và đảm bảo vận hành trơn tru.,https://cmcglobal.com.vn/vi/service/custom-software-development-4/
products_services__qa7,products_services,Các dịch vụ nào được cung cấp sau khi phát hành sản phẩm?,"Sau khi phát hành sản phẩm, CMC Global cung cấp dịch vụ hỗ trợ và bảo trì liên tục để cải tiến và nâng cấp sản phẩm.",https://cmcglobal.com.vn/vi/service/custom-software-development-4/
products_services__qa8,products_services,Tại sao CMC Global cần nhận ý kiến phản hồi từ khách hàng?,"CMC Global liên tục yêu cầu và nhận ý kiến phản hồi từ khách hàng để tạo mẫu, kiểm thử và phát hiện lỗi trong quá trình xây dựng sản phẩm.",https://cmcglobal.com.vn/vi/service/custom-software-development-4/
products_services__qa9,products_services,Các giải pháp công nghệ nào CMC Global cung cấp trong phát triển phần mềm?,"CMC Global cung cấp các giải pháp công nghệ mới, giải pháp SaaS và phát triển, tích hợp plug-in tùy chỉnh theo nhu cầu của khách hàng.",https://cmcglobal.com.vn/vi/service/custom-software-development-4/
