qa_id,question_type,question,answer,url
products_services__qa7,products_services,Quy trình kiểm thử bắt đầu từ bước nào?,"Quy trình kiểm thử bắt đầu từ bước Phân tích yêu cầu, nơi chúng tôi xác định yêu cầu kiểm thử và phạm vi công việc.",https://cmcglobal.com.vn/vi/service/testing-service-3/
products_services__qa8,products_services,Tại sao cần lên kế hoạch cho quy trình kiểm thử?,"Lên kế hoạch cho quy trình kiểm thử giúp phát triển chiến lược kiểm thử, lý tưởng hóa nguồn lực, đánh giá rủi ro và lịch trình kiểm thử.",https://cmcglobal.com.vn/vi/service/testing-service-3/
products_services__qa9,products_services,Các bước chuẩn bị trong quy trình kiểm thử là gì?,"Trong bước chuẩn bị, chúng tôi xác định trường hợp kiểm thử và kịch bản thử nghiệm, dữ liệu kiểm thử và thiết lập môi trường kiểm thử.",https://cmcglobal.com.vn/vi/service/testing-service-3/
products_services__qa10,products_services,Thực hiện kiểm thử có những hoạt động nào?,"Trong bước thực hiện kiểm thử, chúng tôi thực hiện kiểm tra khói, trường hợp kiểm thử và xác minh lỗi.",https://cmcglobal.com.vn/vi/service/testing-service-3/
products_services__qa11,products_services,Kết quả kiểm thử được thu thập như thế nào?,Chúng tôi thu thập kết quả kiểm thử và cung cấp bản tóm tắt đánh giá.,https://cmcglobal.com.vn/vi/service/testing-service-3/
products_services__qa12,products_services,Dịch vụ kiểm thử nào giúp doanh nghiệp phát hành sản phẩm mà không gặp trở ngại?,Dịch vụ kiểm thử thủ công giúp doanh nghiệp phát hành sản phẩm mà không gặp trở ngại nào.,https://cmcglobal.com.vn/vi/service/testing-service-3/
products_services__qa13,products_services,Kiểm thử hiệu năng có thể đảm bảo điều gì cho khách hàng?,Kiểm thử hiệu năng đảm bảo bạn có thể cung cấp trải nghiệm khách hàng hoàn hảo.,https://cmcglobal.com.vn/vi/service/testing-service-3/
products_services__qa14,products_services,Kiểm thử tự động hoá ảnh hưởng đến vòng đời phân phối như thế nào?,Kiểm thử tự động hoá rút ngắn vòng đời phân phối.,https://cmcglobal.com.vn/vi/service/testing-service-3/
products_services__qa15,products_services,Kiểm thử đám mây giúp kiểm tra những gì cho ứng dụng?,"Kiểm thử đám mây giúp kiểm tra System Testing, Stress Testing, Load Testing, Latency Testing, Availability Testing và Security Testing cho ứng dụng.",https://cmcglobal.com.vn/vi/service/testing-service-3/
products_services__qa16,products_services,Ai là người thực hiện kiểm thử thâm nhập?,Tester của chúng tôi là người thực hiện kiểm thử thâm nhập.,https://cmcglobal.com.vn/vi/service/testing-service-3/
products_services__qa17,products_services,Kiểm thử thủ công có những loại kiểm thử nào liên quan đến người dùng?,Kiểm thử thủ công liên quan đến Usability Testing để đảm bảo sản phẩm dễ sử dụng cho người dùng.,https://cmcglobal.com.vn/vi/service/testing-service-3/
products_services__qa18,products_services,Quy trình nào được thực hiện trước khi tiến hành kiểm thử?,Quy trình Lên kế hoạch được thực hiện trước khi tiến hành kiểm thử.,https://cmcglobal.com.vn/vi/service/testing-service-3/
products_services__qa19,products_services,Phân tích yêu cầu trong quy trình kiểm thử nhằm mục đích gì?,Phân tích yêu cầu nhằm xác định yêu cầu kiểm thử và phạm vi công việc.,https://cmcglobal.com.vn/vi/service/testing-service-3/
products_services__qa20,products_services,Kiểm thử hiệu suất có vai trò gì trong việc phát triển sản phẩm?,Kiểm thử hiệu suất có vai trò quan trọng trong việc đảm bảo sản phẩm hoạt động hiệu quả và đáp ứng nhu cầu của khách hàng.,https://cmcglobal.com.vn/vi/service/testing-service-3/
products_services__qa1,products_services,Dịch vụ gì giúp quản lý và cải thiện hiệu suất hệ thống đám mây?,Chúng tôi cung cấp dịch vụ Cloud Migration để quản lý tốt hơn và cải thiện hiệu suất.,https://cmcglobal.com.vn/vi/service/vi-cloud-professional-services/
products_services__qa2,products_services,Có những loại dịch vụ Cloud Migration nào được cung cấp?,"Các dịch vụ Cloud Migration bao gồm chuyển on-premise máy chủ sang đám mây, thay đổi nhà cung cấp cloud, và tích hợp hệ thống máy khách với Cloud SASS Service.",https://cmcglobal.com.vn/vi/service/vi-cloud-professional-services/
products_services__qa3,products_services,Dịch vụ Cloud Modernization mang lại lợi ích gì cho hệ thống?,Dịch vụ Cloud Modernization giúp hiện đại hóa hệ thống của bạn để có thể chạy liền mạch trên đám mây.,https://cmcglobal.com.vn/vi/service/vi-cloud-professional-services/
products_services__qa4,products_services,Dịch vụ quản lý đám mây có chức năng gì?,"Dịch vụ quản lý đám mây quản lý, vận hành và vá cơ sở hạ tầng đám mây, phát hiện sự cố và cung cấp các dịch vụ sao lưu dữ liệu.",https://cmcglobal.com.vn/vi/service/vi-cloud-professional-services/
products_services__qa5,products_services,Lợi ích của việc di chuyển dữ liệu sang đám mây là gì?,"Di chuyển dữ liệu sang đám mây giúp loại bỏ các ràng buộc về bối cảnh dữ liệu, giảm chi phí quản lý dữ liệu và nâng cao giá trị dữ liệu.",https://cmcglobal.com.vn/vi/service/vi-cloud-professional-services/
products_services__qa6,products_services,Cloud Migration có thể chuyển dữ liệu từ đâu đến đâu?,Cloud Migration có thể chuyển từ on-premise sang đám mây hoặc từ cloud này sang cloud khác.,https://cmcglobal.com.vn/vi/service/vi-cloud-professional-services/
products_services__qa7,products_services,Dịch vụ nào giúp phát hiện vấn đề trong quản lý cơ sở hạ tầng đám mây?,"Dịch vụ quản lý đám mây giúp phát hiện bất kỳ sự cố, vấn đề và thay đổi nào trong quản lý.",https://cmcglobal.com.vn/vi/service/vi-cloud-professional-services/
products_services__qa8,products_services,Cloud Platform Integration là gì?,Cloud Platform Integration là dịch vụ tích hợp hệ thống máy khách với Cloud SASS Service của bên thứ 3.,https://cmcglobal.com.vn/vi/service/vi-cloud-professional-services/
products_services__qa9,products_services,Dịch vụ nào cung cấp giải pháp dữ liệu doanh nghiệp trên đám mây?,Nền tảng hiện đại hóa dữ liệu cung cấp một bộ giải pháp dữ liệu doanh nghiệp đáng tin cậy trên đám mây.,https://cmcglobal.com.vn/vi/service/vi-cloud-professional-services/
products_services__qa10,products_services,Tại sao doanh nghiệp nên chọn dịch vụ Cloud Modernization?,Doanh nghiệp nên chọn dịch vụ Cloud Modernization để tận dụng các giải pháp cloud-native tốt nhất và tối ưu hóa hệ thống của mình.,https://cmcglobal.com.vn/vi/service/vi-cloud-professional-services/
products_services__qa11,products_services,Có những dịch vụ nào liên quan đến sao lưu dữ liệu trong quản lý đám mây?,Chúng tôi cung cấp các dịch vụ sao lưu dữ liệu và kế hoạch khôi phục sau sự cố.,https://cmcglobal.com.vn/vi/service/vi-cloud-professional-services/
products_services__qa12,products_services,Dịch vụ Cloud Migration nào cho phép chuyển một phần sang nhiều nhà cung cấp cloud?,Dịch vụ Cloud to Cloud cho phép chuyển một phần sang một hoặc nhiều nhà cung cấp cloud để cải thiện hiệu suất.,https://cmcglobal.com.vn/vi/service/vi-cloud-professional-services/
products_services__qa13,products_services,Nền tảng di chuyển dữ liệu giúp giảm chi phí như thế nào?,"Nền tảng di chuyển dữ liệu giúp loại bỏ các ràng buộc về bối cảnh dữ liệu, từ đó giảm chi phí quản lý dữ liệu.",https://cmcglobal.com.vn/vi/service/vi-cloud-professional-services/
products_services__qa14,products_services,Lợi ích của việc tích hợp hệ thống máy khách với Cloud SASS Service là gì?,Tích hợp hệ thống máy khách với Cloud SASS Service giúp cải thiện hiệu suất và khả năng tương tác cho doanh nghiệp.,https://cmcglobal.com.vn/vi/service/vi-cloud-professional-services/
products_services__qa15,products_services,Dịch vụ nào cung cấp kiểm tra định kỳ cho hệ thống đám mây?,Dịch vụ quản lý đám mây cung cấp kiểm tra định kỳ cho hệ thống.,https://cmcglobal.com.vn/vi/service/vi-cloud-professional-services/
products_services__qa16,products_services,Dịch vụ nào giúp xây dựng giải pháp dữ liệu đáng tin cậy trên đám mây?,Nền tảng hiện đại hóa dữ liệu giúp xây dựng một bộ giải pháp dữ liệu doanh nghiệp đáng tin cậy trên đám mây.,https://cmcglobal.com.vn/vi/service/vi-cloud-professional-services/
products_services__qa17,products_services,Dịch vụ Cloud Migration có thể giúp doanh nghiệp làm gì?,Dịch vụ Cloud Migration giúp doanh nghiệp quản lý tốt hơn và cải thiện hiệu suất hệ thống.,https://cmcglobal.com.vn/vi/service/vi-cloud-professional-services/
products_services__qa18,products_services,Điều gì làm cho dịch vụ Cloud Modernization trở nên khác biệt?,Dịch vụ Cloud Modernization cung cấp các giải pháp cloud-native tốt nhất và được tối ưu hóa cho doanh nghiệp.,https://cmcglobal.com.vn/vi/service/vi-cloud-professional-services/
products_services__qa19,products_services,Dịch vụ nào cung cấp kế hoạch khôi phục sau sự cố cho đám mây?,Dịch vụ quản lý đám mây cung cấp kế hoạch khôi phục sau sự cố.,https://cmcglobal.com.vn/vi/service/vi-cloud-professional-services/
products_services__qa20,products_services,Cloud Modernization có giúp cải thiện trải nghiệm người dùng không?,"Có, Cloud Modernization giúp cải thiện hệ thống và mang lại trải nghiệm người dùng tốt hơn.",https://cmcglobal.com.vn/vi/service/vi-cloud-professional-services/
products_services__qa1,products_services,Công ty cung cấp dịch vụ gì liên quan đến tự động hóa quy trình?,Công ty cung cấp dịch vụ tư vấn RPA và tích hợp hệ thống.,https://cmcglobal.com.vn/vi/service/rpa-consulting-system-integration-3/
products_services__qa2,products_services,Tư vấn RPA của công ty có những lợi ích gì?,"Chúng tôi đánh giá khả năng áp dụng RPA, xác định thách thức và cơ hội, tính toán khả năng tự động hóa và tạo kế hoạch chi tiết cho ứng dụng RPA.",https://cmcglobal.com.vn/vi/service/rpa-consulting-system-integration-3/
products_services__qa3,products_services,Công ty có kinh nghiệm bao lâu trong lĩnh vực tư vấn tự động hóa quy trình?,Công ty có hơn 10 năm kinh nghiệm trong lĩnh vực tư vấn tự động hóa quy trình bằng robot.,https://cmcglobal.com.vn/vi/service/rpa-consulting-system-integration-3/
products_services__qa4,products_services,RPA có thể tích hợp với công nghệ nào?,"RPA có thể tích hợp với Phân tích Dự đoán, Học máy và Thiết bị Thông minh trong Tự động hóa Quy trình.",https://cmcglobal.com.vn/vi/service/rpa-consulting-system-integration-3/
products_services__qa5,products_services,Các công cụ nào được sử dụng để tạo ứng dụng RPA?,"Các công cụ như UiPath, Microsoft Power Automate và các công cụ tự động hóa quy trình rô bốt khác được sử dụng để tạo ứng dụng RPA.",https://cmcglobal.com.vn/vi/service/rpa-consulting-system-integration-3/
products_services__qa6,products_services,Công ty có chuyên gia về những lĩnh vực nào trong RPA?,"Công ty có chuyên gia trong các lĩnh vực như Front Office Automation, Web AI Automation, Back Office Automation, HR Automation, và nhiều lĩnh vực khác.",https://cmcglobal.com.vn/vi/service/rpa-consulting-system-integration-3/
products_services__qa7,products_services,Quy trình chuẩn bị RPA bao gồm những bước nào?,"Quy trình chuẩn bị RPA bao gồm các bước như thiết kế giải pháp, xây dựng RPA, kiểm thử RPA, ổn định RPA và cải tiến liên tục.",https://cmcglobal.com.vn/vi/service/rpa-consulting-system-integration-3/
products_services__qa8,products_services,Công ty có cung cấp dịch vụ nào cho tự động hóa dữ liệu không?,"Có, công ty cung cấp dịch vụ tự động hóa dữ liệu.",https://cmcglobal.com.vn/vi/service/rpa-consulting-system-integration-3/
products_services__qa9,products_services,Tại sao việc tự động hóa quy trình lại quan trọng cho doanh nghiệp?,"Việc tự động hóa quy trình giúp tiết kiệm thời gian, giảm rủi ro và tăng hiệu quả trong hoạt động kinh doanh.",https://cmcglobal.com.vn/vi/service/rpa-consulting-system-integration-3/
products_services__qa10,products_services,RPA có thể thay thế những tác vụ nào trong hệ thống?,RPA có thể thay thế các tác vụ thủ công bằng các tác vụ tự động hóa.,https://cmcglobal.com.vn/vi/service/rpa-consulting-system-integration-3/
products_services__qa11,products_services,Công ty sử dụng công nghệ gì để xây dựng lực lượng lao động ảo?,Công ty sử dụng các công cụ RPA mới nhất để xây dựng lực lượng lao động ảo.,https://cmcglobal.com.vn/vi/service/rpa-consulting-system-integration-3/
products_services__qa12,products_services,Lợi ích nào mà doanh nghiệp có thể đạt được từ việc triển khai RPA?,"Doanh nghiệp có thể đạt được các lợi ích rõ ràng như tiết kiệm chi phí, tối ưu hóa quy trình và tăng cường hiệu quả hoạt động.",https://cmcglobal.com.vn/vi/service/rpa-consulting-system-integration-3/
products_services__qa13,products_services,Có bao nhiêu lĩnh vực tự động hóa được công ty chuyên môn hóa?,"Công ty chuyên môn hóa nhiều lĩnh vực tự động hóa như HR Automation, Entry Automation, và Excel Automation.",https://cmcglobal.com.vn/vi/service/rpa-consulting-system-integration-3/
products_services__qa14,products_services,Tích hợp hệ thống có thể mang lại điều gì cho doanh nghiệp?,"Tích hợp hệ thống giúp thay thế các tác vụ thủ công bằng các tác vụ tự động, nâng cao hiệu quả làm việc.",https://cmcglobal.com.vn/vi/service/rpa-consulting-system-integration-3/
products_services__qa15,products_services,Các chuyên gia RPA của công ty có thể hỗ trợ doanh nghiệp như thế nào?,Các chuyên gia RPA có thể hỗ trợ doanh nghiệp trong việc đánh giá khả năng áp dụng RPA và xây dựng kế hoạch tự động hóa.,https://cmcglobal.com.vn/vi/service/rpa-consulting-system-integration-3/
products_services__qa16,products_services,Công ty có kế hoạch gì cho việc cải tiến liên tục trong RPA?,Công ty thực hiện quy trình cải tiến liên tục để tối ưu hóa hiệu suất của giải pháp RPA.,https://cmcglobal.com.vn/vi/service/rpa-consulting-system-integration-3/
products_services__qa17,products_services,Công ty có thể giúp doanh nghiệp trong việc tích hợp AI không?,"Có, công ty có kinh nghiệm tích hợp Web AI Automation trong tự động hóa quy trình.",https://cmcglobal.com.vn/vi/service/rpa-consulting-system-integration-3/
products_services__qa18,products_services,RPA có thể được ứng dụng trong những quy trình nào?,"RPA có thể được ứng dụng trong nhiều quy trình kinh doanh khác nhau, từ front office đến back office.",https://cmcglobal.com.vn/vi/service/rpa-consulting-system-integration-3/
products_services__qa19,products_services,Thời gian quay vòng cho việc xây dựng lực lượng lao động ảo là bao lâu?,Thời gian quay vòng nhanh chóng là một trong những lợi thế của việc sử dụng công nghệ RPA.,https://cmcglobal.com.vn/vi/service/rpa-consulting-system-integration-3/
products_services__qa20,products_services,Công ty có cung cấp dịch vụ liên quan đến việc kiểm thử RPA không?,"Có, công ty cung cấp dịch vụ kiểm thử RPA để đảm bảo tính ổn định và hiệu suất của hệ thống.",https://cmcglobal.com.vn/vi/service/rpa-consulting-system-integration-3/
products_services__qa1,products_services,Dịch vụ gì giúp di chuyển dữ liệu một cách chính xác và đáng tin cậy?,"Dịch vụ di chuyển dữ liệu giúp di chuyển dữ liệu một cách chính xác và đáng tin cậy thông qua dọn dẹp dữ liệu, mô hình hoá dữ liệu và quản lý dữ liệu chủ.",https://cmcglobal.com.vn/vi/service/vi-data-analytics/
products_services__qa2,products_services,Lợi ích của việc di chuyển dữ liệu lên đám mây là gì?,"Việc di chuyển dữ liệu lên đám mây giúp loại bỏ các ràng buộc về tổng thể dữ liệu, giảm chi phí quản lý dữ liệu và nâng cao giá trị từ dữ liệu.",https://cmcglobal.com.vn/vi/service/vi-data-analytics/
products_services__qa3,products_services,Nền tảng dữ liệu hiện đại có vai trò gì trong doanh nghiệp?,"Nền tảng dữ liệu hiện đại giúp khám phá những nhận thức, hiểu biết và insights cho doanh nghiệp.",https://cmcglobal.com.vn/vi/service/vi-data-analytics/
products_services__qa4,products_services,AI và machine learning có thể được ứng dụng để giải quyết vấn đề gì?,"AI và machine learning có thể được ứng dụng để giải quyết các vấn đề cấp bách và sử dụng dữ liệu thông minh để dự đoán, đưa ra quyết định và thực thi một cách hiệu quả.",https://cmcglobal.com.vn/vi/service/vi-data-analytics/
products_services__qa5,products_services,Chúng tôi làm gì để đảm bảo dữ liệu di chuyển là chính xác?,"Chúng tôi thực hiện dọn dẹp dữ liệu, mô hình hoá dữ liệu và quản lý dữ liệu chủ để đảm bảo dữ liệu di chuyển là chính xác.",https://cmcglobal.com.vn/vi/service/vi-data-analytics/
products_services__qa6,products_services,Công nghệ nào được sử dụng trong nền tảng dữ liệu hiện đại?,Nền tảng dữ liệu hiện đại sử dụng các công nghệ tiên tiến.,https://cmcglobal.com.vn/vi/service/vi-data-analytics/
products_services__qa7,products_services,Mục tiêu của dịch vụ di chuyển dữ liệu là gì?,Mục tiêu của dịch vụ di chuyển dữ liệu là đảm bảo rằng dữ liệu được di chuyển là chính xác và đáng tin cậy.,https://cmcglobal.com.vn/vi/service/vi-data-analytics/
products_services__qa8,products_services,Làm thế nào để nâng cao giá trị từ dữ liệu?,Nâng cao giá trị từ dữ liệu có thể thông qua việc di chuyển dữ liệu và cơ sở hạ tầng lên đám mây.,https://cmcglobal.com.vn/vi/service/vi-data-analytics/
products_services__qa9,products_services,Dịch vụ nào hỗ trợ dọn dẹp dữ liệu?,Dịch vụ di chuyển dữ liệu hỗ trợ dọn dẹp dữ liệu.,https://cmcglobal.com.vn/vi/service/vi-data-analytics/
products_services__qa10,products_services,Doanh nghiệp có thể nhận được thông tin gì từ dịch vụ Data & Analytics?,Doanh nghiệp có thể nhận được thông tin chuyên sâu hữu ích và quyết định nhanh hơn từ dịch vụ Data & Analytics.,https://cmcglobal.com.vn/vi/service/vi-data-analytics/
products_services__qa11,products_services,AI và machine learning giúp doanh nghiệp như thế nào?,"AI và machine learning giúp doanh nghiệp dự đoán, đưa ra quyết định và thực thi một cách hiệu quả.",https://cmcglobal.com.vn/vi/service/vi-data-analytics/
products_services__qa12,products_services,Lợi ích của việc triển khai nền tảng dữ liệu là gì?,Lợi ích của việc triển khai nền tảng dữ liệu là khám phá những nhận thức và hiểu biết cho doanh nghiệp.,https://cmcglobal.com.vn/vi/service/vi-data-analytics/
products_services__qa13,products_services,Dịch vụ nào giúp loại bỏ ràng buộc về tổng thể dữ liệu?,Dịch vụ di chuyển dữ liệu giúp loại bỏ ràng buộc về tổng thể dữ liệu.,https://cmcglobal.com.vn/vi/service/vi-data-analytics/
products_services__qa14,products_services,Mô hình hoá dữ liệu có vai trò gì trong di chuyển dữ liệu?,Mô hình hoá dữ liệu giúp đảm bảo rằng dữ liệu được di chuyển là chính xác và đáng tin cậy.,https://cmcglobal.com.vn/vi/service/vi-data-analytics/
products_services__qa15,products_services,Công nghệ nào giúp khám phá insights cho doanh nghiệp?,Các công nghệ tiên tiến được sử dụng trong nền tảng dữ liệu giúp khám phá insights cho doanh nghiệp.,https://cmcglobal.com.vn/vi/service/vi-data-analytics/
products_services__qa16,products_services,Dịch vụ nào giúp quản lý dữ liệu chủ?,Dịch vụ di chuyển dữ liệu giúp quản lý dữ liệu chủ.,https://cmcglobal.com.vn/vi/service/vi-data-analytics/
products_services__qa17,products_services,Dịch vụ nào giúp doanh nghiệp đưa ra quyết định nhanh hơn?,Dịch vụ Data & Analytics giúp doanh nghiệp đưa ra quyết định nhanh hơn.,https://cmcglobal.com.vn/vi/service/vi-data-analytics/
products_services__qa18,products_services,Chúng tôi di chuyển dữ liệu bằng cách nào?,"Chúng tôi di chuyển dữ liệu bằng cách dọn dẹp dữ liệu, mô hình hoá dữ liệu và quản lý dữ liệu chủ.",https://cmcglobal.com.vn/vi/service/vi-data-analytics/
products_services__qa19,products_services,Insights trong doanh nghiệp được tạo ra từ đâu?,Insights trong doanh nghiệp được tạo ra từ việc triển khai nền tảng dữ liệu đáng tin cậy và sử dụng công nghệ tiên tiến.,https://cmcglobal.com.vn/vi/service/vi-data-analytics/
products_services__qa20,products_services,Dịch vụ nào giúp doanh nghiệp sử dụng dữ liệu thông minh?,Dịch vụ AI và machine learning giúp doanh nghiệp sử dụng dữ liệu thông minh.,https://cmcglobal.com.vn/vi/service/vi-data-analytics/
products_services__qa1,products_services,CMC Global cung cấp dịch vụ gì trong lĩnh vực AI?,"CMC Global cung cấp dịch vụ Tư vấn nền tảng AI, giúp tổ chức sử dụng AI để cải thiện trải nghiệm cho khách hàng.",https://cmcglobal.com.vn/vi/service/al-consulting-implementation-3/
products_services__qa2,products_services,Ai là người thiết kế giải pháp cho các vấn đề trong dịch vụ Tư vấn nền tảng AI?,Các chuyên gia AI của CMC Global là những người thiết kế giải pháp cho các vấn đề chưa tồn tại.,https://cmcglobal.com.vn/vi/service/al-consulting-implementation-3/
products_services__qa3,products_services,CMC Global có những giải pháp AI nào?,"CMC Global có các giải pháp như CIVAMS, CADTECH, C-OCR, CMC Voices, và C-Chatbot.",https://cmcglobal.com.vn/vi/service/al-consulting-implementation-3/
products_services__qa4,products_services,Giải pháp CIVAMS của CMC Global có chức năng gì?,CIVAMS cung cấp giải pháp phân tích video và nhận dạng khuôn mặt.,https://cmcglobal.com.vn/vi/service/al-consulting-implementation-3/
products_services__qa5,products_services,Chức năng chính của CADTECH là gì?,CADTECH chuyên về phân tích chuỗi thời gian và phát hiện bất thường.,https://cmcglobal.com.vn/vi/service/al-consulting-implementation-3/
products_services__qa6,products_services,C-OCR giúp chuyển đổi loại văn bản nào?,"C-OCR chuyển đổi hình ảnh của văn bản đánh máy, viết tay hoặc in thành văn bản được mã hóa bằng máy.",https://cmcglobal.com.vn/vi/service/al-consulting-implementation-3/
products_services__qa7,products_services,Giải pháp CMC Voices của CMC Global có tính năng gì nổi bật?,CMC Voices cung cấp giải pháp chuyển văn bản thành giọng nói và lời nói thành văn bản.,https://cmcglobal.com.vn/vi/service/al-consulting-implementation-3/
products_services__qa8,products_services,C-Chatbot được sử dụng để làm gì?,C-Chatbot là giải pháp AI Chatbot dùng để đàm thoại tự động và phản hồi real-time trên website hoặc ứng dụng.,https://cmcglobal.com.vn/vi/service/al-consulting-implementation-3/
products_services__qa9,products_services,Dịch vụ Kỹ sư hỗ trợ ứng dụng có lợi ích gì?,"Dịch vụ này giúp tận dụng công nghệ mới như quảng cáo video thông minh, AR/VR để tối ưu hóa thiết kế nền tảng AI.",https://cmcglobal.com.vn/vi/service/al-consulting-implementation-3/
